Comment,Compound,Positive,Neutral,Negative
"I'm a fan of Airbnb. I am worried about their financial health, b/c even in Q4, they were bleeding cash. I'm sure Q1/Q2 will be brutal. They could raise private capital no problem, but probably have the screws turned more than normal right now.",-0.7003,0.068,0.723,0.209
We appreciate your patience and understanding as we are experiencing a large volume of inquiries due to COVID-19. We encourage you to continue to visit our help center for updates as matters progress: http://abnb.co/gx2p5,0.891,0.31,0.69,0.0
Big shout out to @Airbnb for giving me a full refund on my Atlanta trip when I was technically past the point of that.,0.34,0.103,0.897,0.0
Airbnb extends no-charge cancellation policy due to coronavirus https://tcrn.ch/2QcyT5A by @etherington,0.128,0.13,0.87,0.0
This policy means that hosts and guests impacted by the coronavirus outbreak will be able to cancel their homes reservation or Airbnb Experience without getting charged. ,-0.1048,0.058,0.87,0.072
Dear @airbnb @AirbnbHelp I got a popup said I would get full refund for cancelling our Tulum booking but my refund receipt shows $82 cleaning fee. Why would you show a misleading popup? This is bait and switch.,-0.4854,0.048,0.821,0.131
Airbnb ,0.0,0.0,1.0,0.0
"Heads up for everyone who had booked AirBnB accomodation for the Miami Open (or anywhere else in the area): AirBnB is offering full refunds, no questions asked, regardless of the original booking’s cancellation policy.",0.0258,0.063,0.877,0.06
"Coronavirus: Airbnb to issue refunds, won't charge US customers for canceling reservations ",0.0,0.0,1.0,0.0
Canceling travel to Italy because of coronavirus: Airbnb got it right. http://Hotels.com didn't.,0.0,0.0,1.0,0.0
"IF YA'LL HAVE AN AIRBNB RESERVATION WITHIN THE U.S. AND WANT TO CANCEL, AIRBNB IS OFFERING REFUNDS FOR ALL RESERVATIONS WITHIN THE U.S.!",-0.2481,0.053,0.854,0.093
Airbnb extends its extenuating circumstances policy to the United States. That should mean a lot more people can get refunds.,0.5106,0.202,0.798,0.0
"New Airbnb announcement: If you booked an Airbnb in the U.S. between now and April 1, you can now cancel without charge Also applies to Europe's Schengen Area, China, South Korea, Italy",-0.25,0.0,0.939,0.061
me responding to the wad of tourists checking into the airbnb next door this morning ,0.0,0.0,1.0,0.0
Let's take advantage of the situation and collapse the AirBnB market into oblivion. Bring down property values fast. Bankrupt international capitalists. Find out what investment funds collapse. Publicize vacant properties. Laugh in their faces! #antireport,-0.4574,0.174,0.609,0.216
"People have paid for things bethuna. Airbnb’s, flights, outfits allof rhaa imeko iyamekuza ",0.0,0.0,1.0,0.0
Tourism nixed by coronavirus: Airbnb got it right. http://Hotels.com didn't. https://trib.al/GsnpEvq,0.0,0.0,1.0,0.0
Consulting firm shares top lessons from legendary CEOs like Steve Jobs and Brian Chesky of Airbnb that helped land clients like Vice Media and Snapchat ,0.7906,0.3,0.7,0.0
My Airbnb hosts are so sweet. I’m currently on vacay but they sent me a sweet message checking in and offering me to pick up anything I needed in case I was gonna self quarantine ,0.8286,0.205,0.795,0.0
What do you guys think?! . . 2nd Airbnb goes up this week! This one has been a challenge but we have it done and ready for bookings. . . Some good paint fixed this place quite a bit but we also replaced the kitchen… https://www.instagram.com/p/B9rQZBjHzuo/?igshid=1vy5f1kebiweh,0.8479,0.199,0.801,0.0
"are you an airbnb host feeling the pinch of coronavirus? are you a guest having trouble deciding whether to cancel or struggling to get a refund? DM me here, send me an email: doliver@usatoday.com or call/text 9736689305. thanks and stay safe!",-0.2148,0.151,0.681,0.168
Good Morning! Here are your @cheddar business headlines for March 13. - Disneyland and Disney’s California Adventure will close until April - Major sports leagues suspending seasons due to coronavirus - Airbnb’s losses nearly double in its fourth quarter ,0.4199,0.133,0.801,0.066
"And when again you hear: ""I'll be the Facebook of... the AirBnB of..., the Amazon of..., the Uber of..."" Work on your product, focus on your target, get feedback, iterate &amp; grow before comparing you to a billion dollar company. #Startups #Entrepreneurs #Entrepreneurship #Startup",0.1779,0.039,0.961,0.0
"Every event we planned to attend in New York got cancelled because of a global pandemic. We should be covered under @Airbnb extenuating circumstance policy, but #AirBnB doesn’t want to refund us our money. @AirbnbHelp do the right thing.",-0.0129,0.037,0.924,0.039
my airbnb got cancelled for this weekend in london bc of covid-19! currently homeless!,-0.3786,0.0,0.834,0.166
"I don’t know if this is an official policy or not, but I just contacted the Trainline and Airbnb to cancel some tickets due to a trade show being cancelled and was able to get a refund minus a small fee. Always good to ask in these unprecedented times",-0.0387,0.077,0.822,0.1
A Lincoln Park alderman has distributed video showing just how big some Airbnb parties can get. Good luck counting all the heads as cops clear the joint out again and again… ,0.8807,0.301,0.699,0.0
"AIRBNB BOOKINGS PLUNGE AMID CARONAVIRUS PANDEMIC"" Remember the landlords who rejected tenants, judging their rental contributions 'insufficient'? Click link for more... https://www.neighboursnotstrangers.com/post/airbnb-bookings-plunge-amid-caronavirus-pandemic",-0.5106,0.0,0.864,0.136
Coronavirus proving to be an unwelcome guest for Airbnb’s business ,-0.4019,0.0,0.769,0.231
If I get a Airbnb tomorrow and have a lil party in that bitch. Like this if you’ll come ,0.1027,0.236,0.591,0.173
Sumo-themed Tokyo Airbnb apartment comes with a 'sento'-style bath https://japantoday.com/category/features/travel/sumo-themed-airbnb-apartment-comes-with-a-%27sento%27-style-bath,0.0,0.0,1.0,0.0
when the airbnb was booked and plans were set and you were ready to spend spring break and your birthday on the beach next weekend with your friends but then a whole pandemic comes to ruin everything ,-0.5267,0.09,0.786,0.124
"Looking for an Airbnb in SA? My man &amp; his homies got you!! They got 2 great locations w/ brand new furniture, beddings, etc. Book your stay ASAP before they’re completely booked ",0.6892,0.135,0.865,0.0
I think there was a camera in the shower vent in our airbnb so if you see me on Pornhub soaping my titties and putting a leg up to wash my pussy....PLEASE MIND YOUR BUSINESS,0.0,0.0,1.0,0.0
What if the government just paid for month-long hotel stays? Or filled up every Airbnb? No one's traveling into Metro Manila anyway.,-0.3736,0.0,0.891,0.109
"Airbnb has seen bookings collapse by 40% in European cities and China because of the coronavirus pandemic, casting doubt on an IPO this year https://on.ft.com/2vTSe4Z",-0.6908,0.0,0.801,0.199
Yup. I'm only ever booking directly through airlines from now on. Had no idea how horrible brokers were to deal with in the event of problems because I've never had a major issue come up before.,-0.8126,0.0,0.792,0.208
"While the rest of the world bands together to stop the spread of COVID-19, @Airbnb is being MALICIOUSLY IRRESPONSIBLE by refusing to update their extenuating circumstances policy to refund customers who need to cancel their reservations. This WILL spread the virus! ",-0.8697,0.0,0.774,0.226
"Dreamville being mad unfair rn. NC is in a state of emergency for the virus. All athletics entertainment is suspended. People flying in, out of the US won’t be able to come, even if they wanted to. We need time to re-book flights for a future date & get refunds from Airbnb.",-0.8481,0.048,0.748,0.204
"The coronavirus pandemic is already posing a drag on Airbnb bookings and revenue, according to new data from research firm AirDNA. ",-0.2263,0.0,0.909,0.091
Did my Miami Airbnb host just cancel our reservation? MA’AM ,-0.25,0.0,0.818,0.182
"It’s only a matter of time, @Airbnb. Why not do the right thing before you have no other choice? ",-0.2732,0.057,0.829,0.114
airbnb or party ? ,0.4019,0.574,0.426,0.0
"11/ There will be monster businesses built soon! Many of the best businesses scaled in 2008 or 2001. Google, Facebook, Airbnb, etc. A correction accelerates behaviors, i.e. share economy scaled in 2008 b/c people needed extra cash. Remote work &amp; crypto are my bets for this one",0.7712,0.132,0.868,0.0
"New York is under a state of emergency. Everything is closed. There’s a pandemic and @Airbnb stills expects you to go on vacation there and won’t refund your money. Never again, @Airbnb #Airbnb",-0.3818,0.0,0.92,0.08
I am truly disappointed by how @Airbnb does not truly care enough to issue my refund. They are the same people that chose to send emails saying they can accommodate for those affected my COVID-19. This is terrible.,-0.5615,0.123,0.656,0.221
#Breaking... The St. Pete GP will now be run on my AirBNB bedroom floor as I make vroom vroom noises with this hot wheels car. ,0.0,0.0,1.0,0.0
my boyfriend has 9 friends in town visiting for a ski trip (they’re staying at an airbnb)... if the coronavirus shuts down the airports and i have to host these frat boys i’m gonna lose my mind,0.1027,0.082,0.847,0.071
"Even though the Dutch tourist family was very nice, it really pissed off the rest of the guys when you rented out our kick drum as an AirBnB.",-0.34,0.092,0.774,0.134
"I have 2 airbnb listings, a friend who also has an Airbnb said guests would take all the extra TP stored there. 2 night stay and 5 rolls gone. I need some for mine and found some at a 7/11. This need to hoard TP is beyond crazy. What is wrong with everyone ",-0.3182,0.062,0.832,0.106
"Whatever brings you comfort tonight, I wish that for you. For me, it’s baseball. After that, a baked potato and a feral cat shelter at an Airbnb in AZ makes the list. Also, Dylan on my Spotify (sorry/not sorry, HJ) ",0.5994,0.128,0.84,0.032
"Hey, @Airbnb I am APPALLED that these are the kinds of hosts you have. You mean to tell me that during a national pandemic I am supposed to risk my health, and more importantly, those around me who are more likely to catch the virus just so that I don’t have to be given a refund? ",-0.5007,0.046,0.851,0.103
Me and the homies waiting for the keys to the AirBNB at Afronation next week ,0.0,0.0,1.0,0.0
".@amazon If you really care that much, why can I buy this pack from these people in the article for $99 plus $33.30 shipping? Certainly doesn't look like ""there is no place for price-gouging on Amazon"". Turning into the AirBnB of online retail. ",0.3783,0.122,0.788,0.089
"so, toracon has been cancelled. unfortunately it was my most expensive con since i paid for both me and my sister's airbnb stay + table fee + amtrak tickets, and amtrak is refusing to refund me even though i have travel insurance. im down $500+ and it's really upsetting.",-0.8588,0.0,0.796,0.204
Why the fuck would @Airbnb only want to give HALF of our money back for something that is beyond our control ?!! This is a pandemic that’s going on and you don’t have the decency to give us a full refund or even let us reschedule for a different weekend ?,-0.6303,0.026,0.887,0.088
might take this break from school to book a cheap flight to idk like new york or la where i can meet up with all my internet friends and quarantine ourselves in an airbnb together ,0.6369,0.151,0.811,0.038
Party at our airbnb next week . LMK IF YOU GUYS ARE DOWN ,0.4019,0.197,0.803,0.0
"Fuck it, if we don’t have a prom I’ll Airbnb that bitch and invite everyone. We finna do one of those Black Plague parties. CLASS OF 2020 WILL HAVE A PROM ",-0.6124,0.117,0.683,0.199
Hi @Airbnb we've asked for a refund on our london stay since we currently have travel restrictions because of coronavirus BUT we only see a small refund of 15pounds. How can we know for sure you'll be giving a full refund????,0.7912,0.163,0.837,0.0
Thank you to my friends for helping me get the attention of @Airbnb. I just got a full refund for my trip to Austin. Much appreciated.,0.8779,0.357,0.643,0.0
"I did YC in the Summer of 2008. Lehman died the day we closed our Posterous seed round. Nobody else raised money. As a result, we were the least valuable YC batch on record. 73% of those companies died immediately. Airbnb was funded the next batch, Winter 2009! ",-0.8763,0.0,0.811,0.189
AirBnB really should be getting rid of their service fee for cancellations considering what's happening.,0.0,0.0,1.0,0.0
Airbnb’s are awesome and all until you can’t find a single thing over 60 pounds to curl. What’s the point of this super sick pool in the back if I can’t get an appropriate pump before the girls show up?,0.7525,0.186,0.744,0.07
"Airbnb must be going through a really hard time with corona. Airlines, airports, hotels, tourism. There’s no contingency plan to almost zero revenue.",-0.4391,0.0,0.837,0.163
so airbnb only refunded me my service fee but my host went OUT OF HIS WAY to refund me almost my entire cost A LITERAL KING!!!!!!! ,0.0,0.0,1.0,0.0
On our way for spring break and I just now realized that our AirBnB that we’re staying in is called “The Corona House”,0.0,0.0,1.0,0.0
DID AIRBNB IPO YET?,0.0,0.0,1.0,0.0
how me and my girl are when the airbnb has a nice bathtub ,0.4215,0.203,0.797,0.0
Niggas gon fly to LA for $57 just to be with the homeless people because they can’t cop an AirBnB,-0.34,0.0,0.888,0.112
"Hey @Airbnb if ""the wellbeing of [y]our community [y]our is your priority"" the right thing to do is to let everyone cancel travel plans, full refund or credit, no questions asked. I mean, the better time would've been 2 weeks ago, but now's good, too.",0.6705,0.156,0.78,0.064
I bet a lot of Airbnb/STR landlords are wishing they had opted for long-term tenants right now.,0.2263,0.119,0.881,0.0
"Actually insane that @Airbnb does not consider our situation to fall under their ""extenuating policy"" when the event we were traveling to got shut down by a global pandemic????? I will personally never be using airbnb again after this situation. ",-0.5661,0.0,0.91,0.09
Who house can i come to ? Anybody wanna get a Airbnb for 2 weeks ? Anything ? I REFUSE to sit at my house bored !,-0.7064,0.0,0.743,0.257
Idk about y’all but I already secured my Airbnb for those new Beyond dates. I will not be caught slippin,0.5187,0.171,0.771,0.058
Sooo edm airbnb party ?,0.4019,0.474,0.526,0.0
Airbnb IPO under threat as bookings plunge ,-0.5267,0.0,0.638,0.362
Airbnb put out an updated policy because of what’s going on right now. ,0.0,0.0,1.0,0.0
In lieu of a current AirBnB Sessions song..... ,0.0,0.0,1.0,0.0
All infavor to sue @Airbnb say I ,0.0,0.0,1.0,0.0
"@reylo_prompts Rey is a writer who books an AirBnB cabin on a farm hoping to get her novel finished. The host, Luke, is a crusty old hippie. Unfortunately when she arrives he’s traveling and her host for two weeks is instead his sullen looking enormous nephew Ben.",0.0,0.102,0.797,0.102
Soooo is Orange n White weekend not happening now cause I need to know if I should cancel this AirBnB ,-0.25,0.0,0.889,0.111
"It's also ok for persons to be disappointed about Carnival (though we haven't heard of it being cancelled, it might be). There's a lof of people who booked tickets, asked for vacay, paid 40k-100k+ for costumes, airbnb, hotels etc...they can be upset if they want to 1/2",-0.6369,0.067,0.785,0.148
"Source: Airbnb reported a loss of $276.4M in Q4 before Covid-19 hit, nearly doubling YoY from $143.7M; revenue was up 32% to $1.1B, and it has $2B+ in the bank (Bloomberg) https://www.bloomberg.com/news/articles/2020-03-12/airbnb-s-loss-nearly-doubles-in-fourth-quarter-before-virus-hit",-0.3182,0.0,0.929,0.071
You gave up your full time job to do Airbnb? https://twitter.com/mattlundy33/status/1237772778465636352,0.0,0.0,1.0,0.0
"Hey @Airbnb, I have been trying to cancel a reservation due to #coronavirus but you have not responded to online messages and hung up on me 2x. Airlines, hotels, rental car agencies, and other providers have all refunded our expenses and been lovely. Why aren't you prepared?",0.572,0.103,0.828,0.069
say you covered someone’s airbnb for anaheim and they havnt payed you back? do you fly cross country to pull up or what,0.0,0.0,1.0,0.0
@Airbnb hey I need someone to reach out to me about only receiving 50% of a refund for canceling a trip to a foreign country (Canada) where international flights could potential be held. That’s absolutely ridiculous.,-0.4005,0.032,0.885,0.082
My @airbnb host is refusing to give me a refund ($1500 airbnb) :/. Been trying to communicate with airbnb support the past 36 hours. Support had been nothing but great help in this hectic time. Just wish my airbnb host wasn't greedy scum.,-0.1243,0.18,0.65,0.17
"Wow, so @Airbnb is not handling this well. What about a worldwide pandemic is NOT an “extenuating circumstance?” I’m certainly paying attention to which travel companies are handling this with grace and which one are not. ",0.8853,0.268,0.732,0.0
Reason number 437 why Airbnb is not on my love list. ,-0.471,0.095,0.658,0.246
Hey @Airbnb you should be embarrassed about your refund policy given the current state of the world.,-0.3612,0.0,0.865,0.135
"Hey @AirbnbHelp, if “the wellbeing of our community is our priority”, please let folks that have to cancel their plans, especially those traveling with elderly family members, cancel their trips. This is clearly an “extenuating circumstance”. This is dangerous. #airbnb ",-0.2732,0.106,0.743,0.151
sounds like full-time Airbnb hosts are in a rough spot. hope that centralized support from their parent company and thoughtful government regulation gets them through this rough patch. ,0.8658,0.318,0.682,0.0
"Airlines and Airbnb’s not wanting to refund you because of the virus? Like how is that not a good enough reason, who could have predicted something like this to happen and prepare for it?! ",0.5017,0.149,0.788,0.063
What those Airbnb prices looking like though ,0.3612,0.294,0.706,0.0
Been on hold with @AirbnbHelp for a while now and the line hung up before I could reach an agent. Would like to get a full refund for my bookings. @Airbnb,0.3818,0.122,0.878,0.0
"aside from the massive hit the virus will have on airbnb's business, it's also just awkward that their rental operators are called ""hosts""",-0.1531,0.0,0.932,0.068
cheap flights and airbnb vs. my mania,0.0,0.0,1.0,0.0
"Yooooo hmu to be on that list guaranteed , they always packed and wouldn’t want y’all waiting outside Airbnb last week was popping now this shop party gone be memorable ",0.4588,0.129,0.871,0.0
Lucy the Elephant's Airbnb listing booked in seconds. Meet the lucky guests staying in the Jersey Shore landmark. ,0.4767,0.204,0.796,0.0
Airbnb is 52 a night for a whole 3 bedroom apartment Lessgettitttttt ,0.0,0.0,1.0,0.0
Airlines are actually doing the right thing right now with change fee waivers. @Airbnb and @hotelsdotcom and other accom. needs to do the same. A person shouldn't have to choose between cancelling and staying safe or going because they can't afford to lose thousands of dollars.,0.52,0.105,0.858,0.037
"Aaaand @Airbnb is refusing to refund cancellations of European bookings by Americans, even after the new travel ban. Your profits were $4b in 2019. Maybe don't do this? ",-0.5267,0.085,0.731,0.184
NEW @Airbnb_uk tips for guests! https://youtu.be/pGOd1ap2E0U,0.0,0.0,1.0,0.0
"Silver lining to COVID-19, because fuck AirBnB and what they've done to the city I live in (and many others). ",-0.5423,0.0,0.837,0.163
"So #4C20 has been officially canceled and while I expected this and completely understand, I am sad that I won’t be seeing my friends and colleagues. I already talked with my panel yesterday and we canceled our Airbnb due to travel restrictions. Crazy times we live in. ",-0.3947,0.063,0.819,0.118
The Puck Podcast was started in 2006 & the following things did not exist: - Uber/Lyft - Airbnb - iPhones - Instagram - Fitbits - Spotify - Bitcoin We've seen a lot in the last 14 years &amp; will be on the air every week for however long this interruption to the NHL season lasts. ,-0.4357,0.0,0.94,0.06
Airbnb has the worst customer service!!!! #Airbnb,-0.7405,0.0,0.532,0.468
"These industries will suffer massive losses the rest of the year Entertainment -Broadway, movies, music Travel -Airlines, Oil & Gas, rentals Hotel -all of them, Airbnb, vrbo Restaurant -any sit down place Tourism -Vegas, Disney, borders closing What else?",-0.5267,0.064,0.795,0.141
All 5 of my friends I booked the Airbnb with for the weekend said “ Nai what you talking about we still going to oakland and having a good time “ and this is why I love them cause I’m crying and they still down to mob me with me regardless of everything goin on ,0.7964,0.175,0.772,0.053
"more like: ""they did fine because they spammed, cheated, and encouraged breaking tax and tenancy laws all around the world. By growing faster than regulators could stop them, they eventually won."" airbnb was a ddos attack on global housing supply and nobody stopped them in time. ",-0.4033,0.156,0.657,0.187
No sympathy for airbnb operators. Its a gamble like any other investment.,0.4215,0.329,0.526,0.145
Yeeeeesh lack of Airbnb bookings is going to be the cause of mortgage foreclosures that then opens up affordable housing for folks. Who’d have thunk it.,-0.6908,0.0,0.808,0.192
Good morning to everyone except @TurnKeyVR &amp; @vrbo scamming selves. I have two house reservations for Coachella weekend in April that equate to $10k+ they don’t want to refund. SCAMMERS!!!! Don’t ever book with them. Use @Airbnb,0.6562,0.136,0.864,0.0
"i’m sorry but something needs to be said NOW about whether Beyond Wonderland is still happening or not. cancelling it last minute would be fucked up, i need to know whether i need to cancel flights/my airbnb. it’s literally in a week.",-0.8343,0.04,0.75,0.209
You'll never want to use AirBnB again after reading Vice's investigation into all the scams run on travelers ,-0.6152,0.0,0.761,0.239
"Both Vanderbilt & my study abroad program in Madrid advised me to fly home. But w President Trump's travel ban, I was concerned about making it back. While I managed to book a flight, I received this from a previous @Airbnb host in Toledo. The world needs more of these people ",-0.7096,0.0,0.898,0.102
that website is Airbnb in a microcosm. Seize control of the narrative and elect yourselves as spokespersons for the entire building and neighbourhood. Twisted.,0.0,0.0,1.0,0.0
"A Strata sting has resulted in a Vancouver woman having to pay more than $45,000 in fines for repeatedly renting out her condo through Airbnb. ",-0.1027,0.0,0.94,0.06
"When it seems almost impossible that we'll ever see our flight money back, some joy: We messaged our host on Airbnb in Guatemala and explained the circumstances. He called up Airbnb, waived all fees, and got them to issue us a full refund. Absolute legend. ",0.5859,0.081,0.919,0.0
"Update on my @Airbnb reservation that I had to cancel because of #ExpoWest being cancelled. They denied refund, and denied booking the same reservation for future dates - considering making a company policy to never to book business travel with @Airbnb again #CancelEverything",-0.8316,0.0,0.786,0.214
"AirBNB is part of a cabal of recent tech start ups who are amoral weasels, run by terrible human beings. Said differently: AirBNB Sucks https://www.bloomberg.com/news/articles/2020-03-11/airbnb-refuses-guests-refunds-amid-virus-cancellation-frenzy",-0.802,0.0,0.719,0.281
"They wont just be swimming in your money and holding the decisions back for the fun of it, they'll be buried in risk assessments, processes and in many cases waiting on government advice to trigger insurance issues. You may lose an AirBnB fee, their decision will affect 1000s.",-0.128,0.062,0.847,0.09
"Once upon a 2008, Against all odds, with no investors and thousands of dollars of credit card debt, Airbnb founders had to resort to selling cereals to keep the company afloat. It took almost two years before Airbnb saw some traction. ",-0.2732,0.059,0.835,0.106
The rise of affordable homes on housing estates in the Lakes being put on Airbnb is hugely alarming. The Government need to get a grip on this before its too late. ,-0.2006,0.0,0.942,0.058
"Just read that some AirBNB operators are concerned about how coronavirus is affecting bookings, and given how they've made it damn near impossible for people to find affordable rental housing in many areas, I am having trouble mustering even the most infinitesimal shit to give.",-0.8511,0.0,0.815,0.185
Airbnb is working on “Sign in with Apple” for... Android??? ,0.0,0.0,1.0,0.0
"The first signs of a recession in housing prices are beginning to show in the tourism industry, and in particular with the Airbnb economy. If hosts can't pay their mortgages, what happens next? How Your Airbnb Host Is Feeling the Pain of the Coronavirus ",-0.649,0.058,0.814,0.127
"From water privatisation to Airbnb and Uber, from fighting against cars and diesel pollution to promoting a “relocalised” economy that does not leak cash for shareholders. A battle is brewing in Europe: #CitiesVSMultinationals New series by @corpwatchers https://corpwatchers.eu/en/investigations/cities-versus-multinationals/",-0.2125,0.108,0.763,0.128
"Airbnb raised their first round after YC at the worst possible time: March 2009, the month the market bottomed. They raised at a pre-money valuation of $2.4 million. It didn't matter. They did fine, because they had made something people wanted.",-0.5226,0.041,0.841,0.118
