Comment,Compound,Positive,Neutral,Negative
"My friends (healthcare workers) are looking for places to stay while they distance themselves from vulnerable family. Can you help save lives with whatever space you have? Let's make it happen! #savelivesstayhome @airbnb, @AirbnbHelp, @AirbnbCitizen, @HiltonHotels, @Marriott",0.8122,0.21,0.747,0.043
here’s an old terrible quality picture from my airbnb walk in closet bedroom... haha remember vacations ,-0.0258,0.149,0.697,0.154
Falsely and ineffectively. We've lost track of the number of times @Airbnb @AirbnbCitizen hauled cities into state and federal courts only to walk away empty handed. Not sure it's the same as the number of shootings in @Airbnb rentals but it might be close... #HotAirbnb,-0.4369,0.048,0.821,0.13
I have always have done MUCH more than using @Airbnb’s own data against them. Where you been? You arrived yesterday to manage this latest crisis for Airbnb (and unfortunately the rest of the world).,-0.7579,0.0,0.827,0.173
Was just thinking that I really really hope that this thing takes down the Airbnb property barons. Let’s at least have some good come out of it!,0.7693,0.217,0.783,0.0
the beautiful silver lining of this pandemic has been watching New Orleans AirBnB owners get absolutely dicked on while scrambling to list their units as actual rentals,0.5994,0.13,0.87,0.0
If u combine this with the death of pvt mtgs & short-term rentals than the landscape of the real estate mkt has fundamentally changed - perhaps for a very long time 2 major source of liquidity - helocs & pvt lending And major source of income - Airbnb Has dried up overnight ,-0.5994,0.0,0.917,0.083
"@Airbnb has claimed (falsely) in various courts that it is an intermediary and not responsible for host properties. The (responsible) decision to cancel reservations, but done without consulting hosts and against host cancellation policies sets a precedent that will haunt Airbnb. ",-0.6737,0.0,0.85,0.15
sorry for posting my airbnb problems on twitter! i’m sad i had to cancel my birthday trip to vegas because of covid &amp; the host won’t give me back the $1300 deposit i put down for it because she thinks “it will all be solved by june &amp; i should wait it out” people can be so shit ,-0.8981,0.032,0.753,0.215
HULK BEEN HEARING CHATTER AIRBNB HAS TURNED A BIG CHUNK OF RESIDENTIAL MORTGAGE MARKET INTO SHIT CMBS. ANY THOUGHTS?,-0.5574,0.0,0.825,0.175
"Look I said this when the GG chuds were absurdly labeling themselves a ""consumer rights movement"" but I don't trust consumer rights as a concept, it's so often a cloak for capitalists' rights That rhetoric is what got us Wal-Mart, Amazon, Uber, AirBNB",-0.1372,0.094,0.822,0.083
Airbnb is creating a $10 million relief fund for its Superhosts. The fund started with Airbnb employee donations of $1 million and the company’s three founders are personally contributing the rest.,0.6486,0.159,0.841,0.0
"no joke, living next to an airbnb in downtown toronto was one of the worst housing experiences of my life. vomit in the hallways. broken bottles/cigarettes everywhere. pulsating music at all hours, every day of the week. ruined amenities. no respect for any common areas. awful. ",-0.9081,0.087,0.623,0.29
"Close quarters living, particularly co living, is as dead as the dinosaurs. You add that to airbnb. ",-0.6486,0.0,0.788,0.212
"COVID-19 could mark the end of Toronto’s Airbnb era, and good riddance. Here’s how to keep it that way | The Star ",0.4404,0.127,0.873,0.0
When This Quarantine Shit Over I Wanna Throw A Wild Ass Airbnb party ,-0.6597,0.152,0.449,0.399
More Toronto Airbnbs are turning into normal apartment rentals thanks to COVID-19 https://bit.ly/2JvExvW #Toronto #Airbnb #RealEstate #Coronavirus #COVID19 #COVIDToronto,0.4404,0.139,0.861,0.0
Re healthcare workers being asked not to share accommodation ....lots of empty apartments out there now that had previously been let through @Airbnb ... maybe some owners would gift renting them to healthcare workers ? #HelpThemHelpUs #KeepSafe,0.0547,0.073,0.834,0.093
Airbnb Superhosts on April 1st ,0.0,0.0,1.0,0.0
AirBNB better get they platform together and in a hurry.,0.4404,0.266,0.734,0.0
Posit: New Uber/AirBnb type companies will take over unutilized assets of corporations because of #COVID19 and become new decentralized entities owned by multiple people running independent franchises but still part owners of the new entities. The age of Cooperatives is here.,0.09,0.033,0.967,0.0
I have Airbnb’s in Summit County UT (Park City). I cancelled all of my guests’ reservations and blocked off my calendars for months so no one else can book. A HUGE financial hit but it’s the right thing to do.,-0.2422,0.05,0.825,0.125
"#Airbnb in #Vancouver - “DOUGLAS PARK Cozy family home with high airBNB Revenue!” reads the listing by Vancouver realtor Melissa Wu, who runs a side hustle peddling “immune boosting” supplements... #VanRE",0.0,0.0,1.0,0.0
Hands up. Anyone else want to see AirBNB banned after this is all over? ,-0.4019,0.08,0.736,0.184
"In Whitefish, MT, an email blast from a local rental company advertised to those “looking for a great spot to isolate or self-quarantine."" The owners of one Airbnb in Bozeman briefly listed it as “The Last Best Place to Quarantine.” (h/t to @kemc for that one)",0.8176,0.162,0.802,0.035
"I had stayed at some airbnb and forgotten to log off youtube, so in an attempt to sign out of all devices I stumbled upon the location history that had basically shown where I had been for years and years. I had no idea. Super scary to realize, thought I'd scrubbed all that.",-0.34,0.069,0.801,0.13
Tell me your secret Airbnb locations Have pockets full of cash looking to scoop more up in a new area,0.1531,0.082,0.918,0.0
AirBnB hopium channels emerging. ,0.0,0.0,1.0,0.0
COVID-19: Airbnb hosts selling properties as bookings vanish #vanre #vanpoli #covid19 https://thinkpol.ca/2020/03/31/covid-19-airbnb-hosts-selling-properties-bookings-vanish/,0.0,0.0,1.0,0.0
@MassGovernor says hotels and @Airbnb can no longer be booked for vacation purposes. They should be used only to support #COVID19 fight such as housing healthcare workers or others who are displaced from their homes.,-0.2732,0.068,0.81,0.122
Who wants to stay in an #Airbnb that was previously occupied by someone in quarantine with #coronavirus? This sounds very dangerous with no guarantees about cleaning standards. #topoli @Fairbnbcanada,-0.7056,0.0,0.822,0.178
"It is very concerning that some AirBnB hosts are advertising their rental properties as safe havens for quarantine. We are all safer if we follow the rules and stay at home. This is a time for cooperation, not profiteering.",0.7306,0.17,0.83,0.0
"Another caddy legend! Jan, 27 years on tour, telling us how caddies got around before cheap flights and AirBnB! #MoreThanCarryingABag #DailyCaddyStory",0.0,0.0,1.0,0.0
I wish me n all my art twitter friends could rent an airbnb somewhere and just make art and smoke weed and read each other’s tarot cards and talk about the universe n love each other ,0.875,0.25,0.75,0.0
"Three weeks ago, a friend saw all of his Airbnb reservations cancel because people stopped traveling. But they’ve since picked up as individuals living with someone who tested positive for coronavirus need ways to socially distance themselves.",0.7227,0.167,0.763,0.07
this could never be a thing again because the wealthy-landowner would just put the hermit's grotto on Airbnb as a rustic cottage ,0.0,0.0,1.0,0.0
"""the rapid collapse of Airbnb listings is returning a flood of units into the urban housing supply....It raises the question: In the midst of an affordability crisis, why didn’t cities regulate companies like Airbnb much more stringently to begin with?"" ",-0.7003,0.055,0.786,0.159
"Now guests who had previously booked stays on Airbnb with a check-in between Mar. 14th &amp; May 31st are now eligible for full refunds under the companys “extenuating circumstances” policy, regardless of the host’s cancellation preference so long as the booking was made b4 Mar 14",0.0,0.0,1.0,0.0
"They've faced a lot of criticism for hoarding housing supply in Toronto. Now, Airbnb hosts — esp. the ones who have multiple properties — are (like everyone else) having a rough go at it ",-0.4404,0.0,0.909,0.091
.@Airbnb to pay out $250m to hosts to help ease Covid-19 cancellations #flapol,0.5859,0.313,0.602,0.084
Airbnb announced it will allow guests to receive full refunds for trips starting on or before May 31 that were booked prior to March 14 as the company continues to struggle through the coronavirus’ impact on the travel industry. ,-0.1027,0.046,0.898,0.056
"AirBnB Superhist panic sell/rent = small blip of inventory rise 1/3 of population unemployed, GDP collapse, ballon payments, etc. That’s what moves needles ",-0.7579,0.0,0.755,0.245
Look at this cute airbnb i just booked! ,0.5848,0.387,0.613,0.0
"Authors find Airbnb transactions are tax-compliant in the absence of a formal collection agreement. Just accepted new paper by Andrew Bibler (@AndrewBibler), Keith Teltser (@kteltser), Mark Tremblay (@tweetMTrem). Read the WP here:",0.7925,0.223,0.777,0.0
"My @TorontoStar column this week: COVID-19 seems to be forcing landlords to turn away from Airbnb and actually look for long-term tenants. There are no silver linings to this tragic, awful pandemic, but I’ll say it: this is a good thing. ",-0.0,0.084,0.788,0.128
"Wow, $800,000,000 -> ""Airbnb shut down its marketing efforts last week, saving an estimated $800 million annually."" https://www.theinformation.com/articles/airbnb-costs-under-microscope-as-travel-shrinks?utm_content=textcta&amp;utm_campaign=%5Brtsu%5D+Automated+RTS&amp;utm_content=1001891&amp;utm_medium=email&amp;utm_source=cio&amp;utm_term=1000266",0.5859,0.183,0.817,0.0
"FOR IMMEDIATE RELEASE: PREMIER FORD NEEDS TO BAN SHORT-TERM RENTALS ACROSS ONTARIO DURING THE COVID-19 PANDEMIC New data shows dozens of Ontario cottage rentals advertised as quarantine destinations, placing locals at risk. cc/@fordnation #ONpoli #COVIDー19 #Airbnb ",-0.7531,0.0,0.841,0.159
With people losing their job and having trouble paying rent real estate is going to drop.People who are over leveraged (looking at you Airbnb)are going to short sell themselves out of debt.Further decreasing home prices. Save up so you can buy a house in 2021 during the trough ,-0.2732,0.061,0.838,0.101
"I miss Boston. If we didn’t have a public health crisis, a few panic attacks ago, I would have booked a cheap Airbnb and flight for a weekend away in my favorite American city and such. also here is the most Boston photo of me in Boston back in the summer when humans could travel ",-0.836,0.051,0.747,0.202
"They are not. They are securitized in standard agency and non-agency MBS, and non-QM pools. Sucks fir all those hosts, but I agree 100%...it will take a lot more than this to bring housing down.",0.2458,0.089,0.822,0.089
"COVID-19 could mark the end of Toronto’s Airbnb era, and good riddance. Here’s how to keep it that way | The Star https://www.thestar.com/opinion/contributors/2020/03/31/covid-19-could-mark-the-end-of-torontos-airbnb-era-and-good-riddance-heres-how-to-keep-it-that-way.html",0.4404,0.121,0.879,0.0
"#Opinion: At risk of finding a silver lining to this godawful and tragic pandemic, I’ll say it: it would be a good thing if it forces more landlords to rent their units instead of listing them on Airbnb. @GraphicMatt: http://torstar.co/eM0R50z0OJI",-0.296,0.067,0.814,0.119
dua collecting the paycheck from our future nostalgia purchases to pay her airbnb rent ,-0.1027,0.0,0.903,0.097
London’s rental market is being flooded by bargain Airbnb listings ,0.2023,0.167,0.833,0.0
"""Of the four million Airbnb hosts out in the world, one-tenth are considered ""Superhosts"""" Yes, 400,000. Each superhost has 10, 20, 30 houses...each with a mortgage. Avg price 500k Avg downpayment 7% (35k) This is a ticking time-bomb...a repeat of the 2008 fiasco. ",-0.1531,0.06,0.867,0.073
"Airbnb has expanded its free-homes-for-medics scheme to the UK, encouraging hosts to offer entire homes to NHS staff ",0.5267,0.167,0.833,0.0
"My group cancelled our TI10 airbnb, looks like a big RIP. Even if the event still happens it seems unlikely I'll go now. fuk u covid19 ",0.128,0.094,0.83,0.075
"Seven Airbnb hosts in Edinburgh, Glasgow, Inverness and near Loch Lomond invited The Ferret to book in defiance of new #coronavirus rules telling accommodation providers to shut.",0.0,0.0,1.0,0.0
"If you truly believe this then you should be long hotels. People will still travel and need places to stay. Personally, I have seen AirBnB owners switch to a new market of 1-3 month rentals to those in need of housing. The people that are screwed are those that don’t adapt.",-0.0772,0.055,0.885,0.06
"Other things I think might happen with travel after The Days Of Plague: 1. Cruising is properly fucked, and deservedly so. Destinations will reevaluate what letting the big ships in gets them. 2. Airbnb is going to take a legislative kicking. It is clearly driving up rents.",-0.4019,0.054,0.858,0.088
"I took mine out before bans and this entire lockdown, no cases in Cyprus or anything, I got my Airbnb refund, but not my flight @wizzair @BootsHelp - disgusted they're not covering this as I can't travel, not my choice, I cannot physically fly there for those dates.",-0.7351,0.0,0.869,0.131
"It took a ton of derivative action for the housing market to collapse (synthetic CDO's and such). Unless @Airbnb assets are packaged under some kinda leveraged market that crosses industries and borders, I doubt those large holders can single-handedly crash the entire housing mkt",-0.7717,0.035,0.79,0.175
"Net migration is about to turn negative as temporary migrants have no jobs and no protection. The massive oversupply of housing which was masked by Airbnb is about to become monumental as the completions continue but the immigrants don’t. https://independentaustralia.net/politics/politics-display/jobkeeper-payment-a-gun-to-the-heads-of-over-one-million-temporary-entrants,13746",-0.5499,0.0,0.87,0.13
Airbnb will give $250 million to hosts who lost income due to coronavirus ,-0.3182,0.0,0.839,0.161
A2. It was Airbnb! - https://www.lonelyplanet.com/articles/airbnb-covid-19-free-accommodation?utm_source=twitter&amp;utm_medium=social&amp;utm_campaign=article,0.0,0.0,1.0,0.0
Airbnb on Monday said it is devoting $250m (R450bn) to help would-be hosts survive financial losses from refunds given to guests who cancelled travel plans due to the coronavirus pandemic. ,0.2732,0.159,0.712,0.129
"It is hard to feel sympathy for AirBnb superhosts with multiple properties. In the UK at least, house prices are hugely inflated out of the reach of regular incomes and are due a correction.",0.296,0.103,0.857,0.04
Airbnb has announced a $250 million Host Relief Fund to cover some costs of coronavirus cancellations ,0.4767,0.181,0.819,0.0
"This so-called ""legal battle"" will come nowhere near ""Holyrood"". Its a planning appeal to Scottish Ministers. ""AirBnB landlords take planning appeal to St Andrews House"" is what is actually happening. ",-0.2732,0.048,0.868,0.084
"Its an appeal to @oyorooms @Airbnb and similar platforms to contribute their properties for quarantine centres. With your furnished facilities on major locations, it will be easier for govt. to cover effected area's faster. #IndiaFightsCorona @narendramodi @drharshvardhan",0.4215,0.072,0.928,0.0
Airbnb to pay compensation to hosts to cover COVID-19 cancellations ,-0.1027,0.0,0.865,0.135
"The fact that 4 AirBnB landlords in ONE stair have the gall to appeal enforcement notices demonstrates the level of self-entitlement, and the utter failure of @Edinburgh_CC and its leader @adamrmcvey to move on this before being forced by public outrage.",-0.8625,0.0,0.794,0.206
"""Airbnb extends coronavirus cancellation window to May 31, sets aside $250 million to pay hosts for missed stays"" ",-0.2732,0.075,0.746,0.179
"It’s also not 25% of the full price, I interpret it’s 25% of the cancellation policy!?!?!?! Halfway there, but still not acceptable. Need a solution for both Guest and Host. Guests have travel insurance which now covers them twice, Hosts have no insurance to cover this....",-0.8553,0.0,0.814,0.186
#Airbnb will pay $250m to landlords for reservations that have been cancelled due to the #coronavirus crisis. Hosts will receive 25% of their normal cancellation fee for stays booked between March 14 and May 31 (if the booking was made on/before March 14),-0.7579,0.0,0.842,0.158
I miss Thunderdome. I miss the people I went with. I miss that Airbnb. I MISS EXCISION Fuuuuck covid-19,-0.6289,0.0,0.584,0.416
Moved into my empty airbnb bedroom for a change of scenery. Quiet. Peaceful. Sparse. Calm. Its like being on a retreat. Except I have to cook my own food. ,0.7906,0.301,0.644,0.055
"it's cute how they say ""the villa is in Southern California"" to make it all mysterious, like you can't just reverse image search. the house is just an airbnb. it even has a website http://www.thejackestate.com/",0.6705,0.147,0.853,0.0
i know many with downtown Chicago condos overlooking the lake. AirBnB'd out to high end business travelers. $700-$1000 HOA fees on top of ridiculous property taxes. so even if they do a mtg deferment.... these people are still screwed.,-0.5994,0.043,0.819,0.137
"AirBnB is about to crash the US housing market. Thousands of super-hosts who bought 10, 20, 30 properties with mortgages and are heavily levered...are all about to default. Without travel there is no rental income to pay these mortgages. In 2-3 months - 2008 all over again Boom",-0.6486,0.0,0.875,0.125
"i really wanna get an airbnb just cause, cause i’m tired of sleeping in this damn house",-0.7206,0.0,0.699,0.301
I should be celebrating the finish of our record rn. Smashing bottles of champagne off the roof of our Airbnb again and all. Here’s a video from when we finished Breaking Point . ,0.7096,0.174,0.826,0.0
Airbnb to pay out $250 million to hosts to help ease coronavirus cancellation pain https://www.reuters.com/article/us-health-coronavirus-airbnb-idUSKBN21H3GD?taid=5e82bc3f53c773000108cbf5&amp;utm_campaign=trueAnthem%3A+Trending+Content&amp;utm_medium=trueAnthem&amp;utm_source=twitter,0.128,0.249,0.526,0.225
dua hasn't left that spot in her airbnb in days,0.0,0.0,1.0,0.0
"I do not at all feel bad for the assholes who signed a bazillion leases, skyrocketing an already fucked renting market, and secretly used them all as airbnb's and are now freaking the fuck out. I feel like everybody should at least be on board with hating *those* guys",-0.9628,0.04,0.621,0.339
"Its happening... Airbnb will pay hosts $250 million to partially cover the cost of coronavirus cancellations. For cancelled check-ins that were slated for March 14 to May 31, Airbnb will pay hosts one-fourth of what they would have received through their cancellation policies",-0.4215,0.0,0.893,0.107
"Confronting sudden income loss, some Airbnb and other vacation rental hosts are working to accommodate the changing face of travel during coronavirus, even as Airbnb commits $250 million to cover losses faced by some hosts ",-0.6705,0.028,0.801,0.171
"Airbnb's CEO compared the coronavirus crisis to Hurricane Maria, saying its business will bounce back, just as it did after the storm that ravaged Puerto Rico ",-0.6249,0.0,0.859,0.141
My brother is coming from Europe & he had to get an airbnb because my mama said we are not taking chances with visitors. What a time.,-0.1511,0.0,0.938,0.062
AirBnB Bubble ,0.0,0.0,1.0,0.0
Airbnb has announced a $250 million Host Relief Fund to cover some costs of coronavirus cancellations https://cnn.it/2ymBHav,0.4767,0.171,0.829,0.0
(Article claims some AirBnB hosts have up to 10 mortgages #bubble) Did the Fed Just Accidentally Trigger a Housing Market Crash? https://www.ccn.com/did-the-fed-just-accidentally-trigger-a-housing-market-crash/ via @ccnmarkets,-0.6249,0.0,0.805,0.195
"4/4: to more than 50,000 @airbnb hosts who have volunteered to open their homes to support health care providers serving all of us on the front lines. ",0.7096,0.191,0.809,0.0
2/4: We are creating a $10m Superhost Relief Fund for @airbnb Superhosts who rent out their own home &amp; need help paying their rent or mortgage. There are hosts who joined Airbnb to stay in their homes &amp; that Airbnb income has been their safety net. https://news.airbnb.com/a-letter-to-hosts/,0.8689,0.205,0.795,0.0
Airbnb says it will give $250 million to hosts on its platform who have lost money from coronavirus-related cancellations at their properties ,-0.3182,0.0,0.901,0.099
Airbnb will pay hosts $250 million to help cover cancellations due to COVID-19 by @meganrosedickey https://tcrn.ch/2UTTcGS,0.3182,0.149,0.773,0.077
"Airbnb extends coronavirus cancellation window to May 31, sets aside $250 million to pay hosts ",0.0258,0.094,0.818,0.088
"CAKE HuMom says us cats can't have any some BS about cats not allowed chocolate The AirBnb Host wanted HuDad to have a cake for his birthday even more then either HuParents knew, she is an amazing and kind human Thank you all for the birthday wishes to HuDad #TeamBob",0.8834,0.201,0.799,0.0
"Residents at a downtown Dallas apartment building say they're trying to shelter in place but others aren't - even hosting large parties in their building using AirBnB. We asked management, city &amp; AirBnB to respond. Watch @NBCDFW @5.",0.5499,0.092,0.908,0.0
Tune in for a message to our hosts from our CEO Brian Chesky today at 3PM PT at http://airbnb.com/live. He’ll answer top questions and discuss what we’re doing to support our host community.,0.5423,0.13,0.87,0.0
"Anyone can be a merchant. (@Amazon) Anyone can be a taxi driver. (@Uber) Anyone can be a journalist. (@Twitter) Anyone can be a movie director. (@YouTube) Anyone can be a hotel owner. (@Airbnb) Anyone can learn. (@Wikipedia) DEAR INTERNET, THANK YOU!",0.7819,0.168,0.832,0.0
BIG NEWS! @Airbnb rumored to have purchased @vrbo @homeaway Airbnb has set a 3:00 pm press conference with no explanation or comment,-0.3595,0.0,0.889,0.111
The Airbnb complaints Facebook group just turned a corner ,-0.4019,0.0,0.722,0.278
Airbnb announces plan to offer free housing to coronavirus responders http://ctv.news/OZBiEnK #canhealth #cdnpoli,0.5106,0.216,0.784,0.0
"There are nearly 14,000 full-apartment Airbnb listings in the city of Montreal, compared to over 3,100 people experiencing visible (street-level) homelessness, according to the last Homeless Count in 2018. The homes are there and they're empty. This is a public health emergency.",-0.5267,0.0,0.899,0.101
"Vermont Gov. Phil Scott has ordered all lodging, including hotels, Airbnb and campgrounds, to suspend operations on Monday. The order suspending lodging applies to hotels, bed and breakfasts, as well as short-term rentals such as Airbnb and campgrounds. ",-0.0516,0.052,0.891,0.057
airbnb owner: how would you feel if you airbnb’d your home out to someone and they threw a party!!? me: lmao i would never airbnb my home him: *stares motherfuckedly*,0.6688,0.142,0.858,0.0
"so a customer service rep for @Airbnb just told me we are no longer eligible for a refund on our cancelled montreal trip, because the check-in date was 3/12, and COVID wasn’t declared a pandemic until 3/13. this is completely false.",-0.4939,0.0,0.896,0.104
A temporary-housing startup backed by Airbnb is aiding in the fight against the coronavirus pandemic by offering discounts to displaced students and healthcare workers ,-0.3612,0.045,0.85,0.105
Your vacation Airbnb has two Master Bedrooms... which one you choosing to sleep in!? #interdesign #blsckdesigners,0.0,0.0,1.0,0.0
Yep. That's how this damn thing is spreading to rural areas. And vacations seem to still be on! Our landlord also owns an Airbnb in our touristy area and he was bragging about how it's all booked up,-0.2998,0.053,0.865,0.082
"There are two main types of AirBnB owners here - those that bought more house than they can afford and want to close the gap by screwing over locals, and those that saw AirBnB as a business venture to profit off of. Both made poor decisions and should absolutely fail.",-0.6801,0.075,0.768,0.157
End of the sharing economy? Airbnb and Uber in trouble as they battle hygiene concerns ,-0.4173,0.137,0.589,0.274
"This #NationalDoctorsDay, we wanted to thank @Airbnb for providing housing to #COVID19 responders and supporting our global #COVID19 response! https://twitter.com/Airbnb/status/1243173359099183105",0.69,0.24,0.76,0.0
"Other possible uses for hotel rooms/AirBnB/resorts based on your replies: — for displaced college students — for ppl exposed awaiting testing (@theleoji ) — for medical personnel, clerks, delivery ppl to sleep near work w/o exposing commuters or family",-0.34,0.0,0.907,0.093
Need to find Airbnb’s like these for the COVID-19 after party ,0.6369,0.366,0.634,0.0
Down on Klisovis there's an Airbnb hotel. An entire building bought specifically for Airbnb. Anyhow. Pame Hotels! Pame! Why don't you open up your empty rooms to people who need them? This is the question. We will be asking them over the next several days. ,-0.3365,0.0,0.949,0.051
Imagine an investment thats largely against the law but you do it anyway & make good money on it for years. Then you have the balls to whine & look for sympathy when you stop making money. In other words shut the fk up airbnb hosts. Investments mean you lose money too.,-0.3612,0.115,0.729,0.156
This boy on my insta got an Airbnb in NY last night with his 10+ friends to party and I just wanna know why some people are so fucking stupid.,0.2092,0.162,0.727,0.111
