Comment,Compound,Positive,Neutral,Negative
"แจ้ง Airbnb มั้ยคะ จบแค่นี้ไม่ได้ ถ้าเป็นเราคงตอบว่า After I read your reply, it’s indeed better for me to stay here cause I don’t want to be tainted by your ignorance and racism. If you still think it’s a flu then I wish you learn what it really is by first hand experience ",-0.0258,0.173,0.669,0.158
"Airbnb is a hotel company that has managed to weasel out of paying most of the costs of being a hotel company, and one of the many ways they've done that is effectively by shifting the real estate exposure on to the company's workforce BUT this still warms your cockles to see ",0.5574,0.087,0.913,0.0
"I just wanna rent an Airbnb for a night, invite my closest friends and get fucked up ",-0.1779,0.223,0.569,0.209
Could AirBNB be the nuclear implosion that sets off the housing bubble collapse? How many AIRBNB units are in Canada @StephenPunwasi ? The 2008 US housing collapse was triggered by the rental housing market stumbling If mortgages start foreclosing into forced sales,-0.8677,0.0,0.796,0.204
Airbnb launches $1 million fund to find and finance world’s most unique home ideas: https://worldarchitecture.org/architecture-news/eenhp/airbnb-launches-1-million-fund-to-find-and-finance-world-s-most-unique-home-ideas.html #architecture #airbnb pic.twitter.com/ACjnf5CGaT,0.0,0.0,1.0,0.0
Me deleting the Airbnb app off my phone after they have refused to grant hard working people refunds due to the coronavirus! Despite Individuals trying to decrease the spread of the virus!! #airbnbsucks @AirbnbHelp pic.twitter.com/UlNG8MvB1Y,-0.2444,0.064,0.821,0.115
"I love how the liberals in this comment thread are all like ""AirBnB is so evil and exploitstive they should just become landlords and work for a living"" lmao ",0.6103,0.27,0.586,0.143
Airbnb guests fume as the company refuses to offer refunds amid the flurry of coronavirus cancellations ,-0.296,0.0,0.872,0.128
"Y’all I spent $800 on one night in a @Airbnb to have the host stalk the property, and harass me and my guest to have Airbnb say there’s nothing they can do about it. TF?!??!? Dude is legit still texting my phone 5 days later.",-0.695,0.0,0.896,0.104
Flights: Booked AirBNB: Booked Riot Fest Ticket: Bought Global: Health Crisis Lineup: TBD,-0.8271,0.0,0.588,0.412
"We are all at the airport guys! We literally were woken up by phone calls at 2am and immediately packed our stuff and headed here. We aren’t heading back to Airbnb, it’s smarter to just stay at the airport since we are already here ! ",0.555,0.077,0.923,0.0
"AirBnb hosts learning what ""gig"" really means.",0.0,0.0,1.0,0.0
"Vancouver strata president busts illegal Airbnb by renting condo unit, owner fined over $46,000 @CityofVancouver should take some notes Unit now for sale 2502 - 999 Seymour Street, Vancouver Bought 2017 $1,160,000 Now asking $1,450,000",-0.5574,0.0,0.902,0.098
As a former host who used to use Airbnb to make ends meet I --- absolutely hope this shakes them. The platform changed for the worse once people like that started buying places just to rent them out. It is an entirely different experience when you stay in someone's actual home.,0.3804,0.104,0.84,0.057
Super bearish for our global macroeconomy. Really sad on that front. But I can’t help but feel terribly excited as a founder Chaos shakes the status quo. The 2008 crash gave us the best projects of the decade: Bitcoin Airbnb Uber What will the 2020 crash create? On it ,-0.4012,0.238,0.501,0.261
Now is a great time to book an airbnb with your boo in the middle of nowhere and just have endless sex until the world survives this apocalypse,0.6249,0.136,0.864,0.0
"Booking with Airbnb since 2013. Never again. Today received a $58 refund on a $3000 booking for cancelling due to Covid 19 because cancellation policy covers only China, Italy and South Korea. If airlines, hotels and car hire companies can do it, so can you. Shame on you Airbnb.",-0.6326,0.0,0.897,0.103
"A man was arrested at the City Hall for impersonating a @CityofVancouver Airbnb bylaw officer. The suspect vehemently denied any wrongdoing, telling the arresting officers: ""I was just sitting here doing nothing."" #vanre #vanpoli",-0.802,0.0,0.78,0.22
Hell no im having a party at an airbnb Saturday we about to turn up one time ,-0.6249,0.12,0.578,0.302
I have zero sympathy. AirBnB creates extremely acute negative externalities.,-0.0972,0.316,0.412,0.273
i’m not going to new york anymore this weekend but airbnb is giving full refunds to people traveling in coronavirus-affected countries ,0.4767,0.134,0.866,0.0
"“I’ve got to keep paying my mortgage somehow,” said one Airbnb host in Tokyo whose rental properties have gone from 80 percent occupied to zero. ",0.0,0.0,1.0,0.0
God please let Airbnb die ,-0.128,0.427,0.194,0.379
"@CapitalOne we the people would like to know the future of #JAMFest, especially with @NCAA’s announcement of no crowds for @marchmadness? We need to know if we need to fight for a refund from @Airbnb and travel plans or if everything is still a go. Thank you for your time. ",0.0516,0.093,0.818,0.089
Lecture classes about to be online cuz of corona. I hope my Airbnb in Hawaii has WiFi,0.4404,0.162,0.838,0.0
"Airbnb Will Give 10 People $100,000 to Build the Unique Home of Their Dreams — With Billy Porter's Help http://bit.ly/33c5H4a pic.twitter.com/hFAZUapvvU",0.6597,0.231,0.769,0.0
airbnb launches $1 million fund to finance world's most unique homes https://www.designboom.com/architecture/airbnb-1-million-fund-unique-homes-03-11-2020/ pic.twitter.com/rxlSw98baV,0.0,0.0,1.0,0.0
Going to be really interesting when Freelancers who have gentrified end up working less than the locals and have more precarious rent situations since they are way higher with less protections that coupled with lack of Airbnb guests to prop it up going to be interesting,0.6542,0.147,0.808,0.044
Special thanks to @Airbnb for refunding me 1k back since my host refused to do so for me despite the fact that I'm not even allowed to enter their airport and would be quarantined for 14 days. Host was keeping my money... Fantastic customers service :D,0.9008,0.234,0.727,0.039
If your Airbnb for Coachella isn’t being refunded hit me!! I could possibly help and tryna help folks get they money back,0.717,0.24,0.76,0.0
my airbnb just refunded me for the dates i booked cause of corona like dam ma is it that serious?,0.296,0.12,0.817,0.062
might fuck around and make my place in chapel hill an airbnb,-0.5423,0.0,0.759,0.241
Hahaha - I hope airbnb hosts go fucking bust over this. It will be the one good outcome out of this situation. ,0.8555,0.356,0.644,0.0
covid-19 is going to divert all revenue from airbnb to onlyfans,0.0,0.0,1.0,0.0
"Airbnb hosts are being impacted by the karmavirus. There is a cure though, it's called the long term renter. Try it. #vanre ""Short-term rentals pinched by coronavirus fears"" https://www.theglobeandmail.com/real-estate/article-short-term-rentals-pinched-by-coronavirus-fears",-0.4215,0.0,0.906,0.094
"Can @Airbnb please explain how me being in quarantine after my recent travel to Northern Italy doesn’t fall under “extenuating circumstances” ... So, you want me to go through with my reservation and potentially infect the host/future guest? Highly unethical, do better.",0.3504,0.145,0.781,0.074
"oh nooooooo coronavirus, please don't financially ruin all the airbnb slumlords. anything but that",0.3991,0.235,0.765,0.0
"are Uber, Postmates, and Airbnb telling people to...WFH...take paid sick days...wait...uh what do we do about gig economy workers again? because if I'm not supposed to go to my office for a month, you probably shouldn't have strangers in your car or house",-0.5106,0.0,0.926,0.074
I hope every single airbnb host goes bankrupt because of pandemic. It's what this extra-vile class of landlords deserve. ,-0.1779,0.129,0.711,0.16
Geez what if virus containment measures break the back of the AirBNB economy and rental units start going back on the market ,0.0,0.0,1.0,0.0
"TIL some Airbnb hosts are straight up liars. Here’s looking at you, @bsumwalt, and the review you left me to cover your own a$$. Oh, and here’s the entirety of our conversation: https://imgur.com/a/QClXTNh #Receipts",-0.3612,0.051,0.858,0.091
"Flight to Florida: $57 per person AirBnb for 4 nights: $50 per person Spending money: $100 per person Whole mini vacay for just a little over $200... If i could use PTO, I’d book it so quick.",0.0,0.0,1.0,0.0
Somebody is gonna make a big enough deal about this and Airbnb will end up eating those fees because now is not the time to be the big bad corporate wolf. ,-0.5423,0.0,0.892,0.108
My AirBNB in Atlanta says Southwest ATL. Polar Rock Terrace. Am I good or do I need to bring that thang w/ me? ,0.4404,0.127,0.873,0.0
tickets: bought airbnb: booked my tummy: got butterflies,0.0,0.0,1.0,0.0
Most hotel corporations have lived through many a recession. Airbnb owners not so much. Was probably better to leave the hotel business to people who knew what they were doing.,-0.0258,0.088,0.79,0.122
"Silver lining. I live in a condo. My mortgage and fees pay for the elevators, hallways, gym, lounge that “guests” abuse. Not to mention the parties and noise. Yeah, Airbnb, I’d like to know how you’re guaranteeing cleanliness.",0.2023,0.168,0.705,0.127
I think few things capture the true stupidity in Toronto's real estate market like hearing about an investor who quit their job to manage 4 Airbnb units. ,0.34,0.175,0.728,0.096
"no classes until april 6th, $64 round trip flight to puerto rico, no confirmed cases of covid-19, and airbnb has wifi? ",-0.5267,0.0,0.812,0.188
Agreed. This was my AirBnB in Cape Town back in May last year in one of the affluent neighborhoods next to the coast with an amazing view of Lions Head. Very affordable. https://twitter.com/Trackmann/status/1237767229850234881,0.7096,0.16,0.84,0.0
#Airbnb expects their employees to work from home during this pandemic but you're expected to go on your vacation like nothing is wrong and you can't get your money back. This is wrong.,0.8724,0.248,0.752,0.0
Had to cancel an Airbnb reservation; the host replied “the media is Controlling us” ,-0.25,0.0,0.867,0.133
"You could lay out every single detail, post the flight and Airbnb information and answer every question before people even get a chance to ask it, then here somebody goes talmbout “What dates are the trip?” ",0.25,0.056,0.944,0.0
"Companies founded 2009-2010 • Uber • Slack • Pinterest • AirBnb • WeWork • Instagram • Groupme • Whatsapp • Stripe My first experience investing in a downturn, but trying to lean in as winners will emerge",0.631,0.138,0.862,0.0
I bet the neighbours of these 4 units hate her. Airbnb takes no responsibility when bad shit happens in neighbourhoods.,-0.9186,0.0,0.519,0.481
"Airbnb hosts are freaking out right now. In a Facebook group for Toronto hosts, one said: ""I quit my full time job to do [Airbnb] full time last May. I have 4 units and they have always performed at 90% occupancy or higher until now."" ",-0.4215,0.0,0.936,0.064
The AirBnb options in Cape Town are absolutely ridiculous in terms of value for money. This one is 5 thousand bob a night. Sleeps two ,-0.101,0.092,0.802,0.107
Coachella-Goers Scrambling for Airbnb Refunds After Coronavirus Postponement ,0.0,0.0,1.0,0.0
"Sadly, in light of the current situation, we have been forced to postpone our @ParisPopfest Paris date with @jeanines_nyc Jeanines. Very gutted. Thanks to @Fly_Norwegian and @Airbnb for being so understanding and not even giving us a voucher. We’ll remember this for next time. ",-0.6765,0.062,0.746,0.191
Just booked the Airbnb for my birthday party/producer cook up session. I got a couple more slots available,0.0,0.0,1.0,0.0
"“Socialism is not Airbnb or crashing on your friend’s couch. Socialism is Venezuela,” U.S. National Security Advisor Bob O’Brien speaking @Heritage on what he likes to explain to millennials.",0.6369,0.161,0.839,0.0
"Brian Chesky, the 37-year-old CEO of @Airbnb is worth an estimated $4.2 billion. He also benefited from $1.5T in tax cuts. His company however will not reimburse or credit my friend’s canceled booking due to the coronavirus. Here’s what a welfare queen looks like: https://twitter.com/terp1999/status/1237380533786738688",0.0041,0.09,0.82,0.09
describe @crssdfest in one word: spiraling We Got Kicked Out of Our Airbnb... CRSSD Spring 2020 Day 1 Vlog LINK: https://youtu.be/K49SbpLgzQE,0.0,0.0,1.0,0.0
"Hi, @Airbnb: I had to cancel a trip because of COVID-19 but it looks like I do not qualify for a refund because it is a trip within the USA. Any chance you'll cover cases like mine, in this serious health crisis? Thanks.",0.6295,0.244,0.59,0.166
New from me: Airbnb may be particularly vulnerable to the economic and health policy shocks of the novel coronavirus outbreak https://www.theglobeandmail.com/real-estate/article-short-term-rentals-pinched-by-coronavirus-fears/,-0.3597,0.092,0.717,0.191
"sanha: what does airbnb mean? eunwoo: well, a b&amp;b is a bed and breakfast- mj: bungeons and bragons!",0.3382,0.138,0.862,0.0
"JAP! Before I start, if you're a first time AirBnb user, please use this link to get RM120 credit for your first stay The credit expires in 30 days after signing up, so dont sign up first if you're not gonna book a stay yet Link for RM120 credit: ",0.8553,0.198,0.802,0.0
Media request: Any Irish #Airbnb hosts experiencing cancellations/decline in bookings due to #COVID19? Please RT,0.3182,0.141,0.859,0.0
"Coachella is postponed. Here's the latest on ticket, airline and Airbnb refunds ",-0.2023,0.0,0.859,0.141
airbnb launches $1 million fund to finance world's most unique homes https://www.designboom.com/architecture/airbnb-1-million-fund-unique-homes-03-11-2020/ pic.twitter.com/lrxYRgZKxF,0.0,0.0,1.0,0.0
She’s already at the Airbnb ,0.0,0.0,1.0,0.0
This Chic Airbnb Is Basically a Spaceship — and the Surrounding Views of the Scottish Highlands Are Out of This World (Video) http://bit.ly/2vZ7k93,0.2732,0.095,0.905,0.0
"Really sad to withdraw from #ISA2020, a conference for which I worked all weekends in the past 2 months to get my papers done. Luckily Durham Uni made the right call to suspend all work-related int'l travel in time for my PhD colleagues and I to get full refunds for our Airbnb 1/",-0.3384,0.06,0.836,0.104
why would you book a room in an #airbnb that clearly states there are 3 resident greyhounds that are very much part of the home and then message and say you are frightened of dogs especially if they touched you ??? #beggarsbelief,-0.1877,0.061,0.861,0.078
"This historic ocean liner may get a second life as a hotel, or an Airbnb, after a $500 million renovation ",0.0,0.0,1.0,0.0
"Shoutout to @Airbnb, @Ryanair, and @hotelsdotcom. All of them have refunded my money for my cancelled Italy trip within 1-2 days. I now have 100% of the trip’s costs back even though my insurance failed to help me.",-0.3818,0.064,0.81,0.126
Coachella-Goers Scrambling for Airbnb Refunds After Coronavirus Postponement ,0.0,0.0,1.0,0.0
"'David Sapiecha, prosecuting for the fire service, said officers found no proper escape routes, leading to the danger that anyone trying to escape would ""get lost in dead ends and panic"".' #Airbnb #Devon #Torquay",-0.9042,0.076,0.6,0.324
Found a man name Michael on airbnb who is a UH alumni. And my man took care of me thank you Houston lol,0.8176,0.321,0.679,0.0
Airbnb is making adjustments to its refund policy in an attempt to balance the needs of hosts and guests during the global coronavirus outbreak ,0.0,0.0,1.0,0.0
"In England, an Airbnb landlord ""flagrantly put at risk people's safety with his desire to make money"", a Crown Court Judge said #airbnb #illegalhotels #torquay #healthandsafety #universalhotelact https://lnkd.in/eTaP23r",0.5267,0.174,0.759,0.066
How to find hidden cameras in your Airbnb rental ,0.0,0.0,1.0,0.0
"""The most famous ship that didn't sink"" to get second life as a hotel, or an Airbnb ",0.0,0.0,1.0,0.0
Can a $500 million renovation turn this historic ocean liner into a hotel or Airbnb you would stay at? ,0.0,0.0,1.0,0.0
"Outraged that @Airbnb won't give full refunds for those who booked homes ($7000+) for @coachella weekend! The County of Riverside/Health Officials said it's not safe, airlines are giving full refunds, but @Airbnb would rather benefit off the crisis and their customers safety??! ",-0.7047,0.107,0.695,0.198
yooo airbnb must be flailing rn with corona or are yall still staying in people's houses?!,0.0,0.0,1.0,0.0
"Forget about staying in your dream home, now you can build the place of your dreams with Airbnb's ""Unique Airbnb Fund!"" pic.twitter.com/CJYLNP2lr0",0.4753,0.193,0.734,0.073
I JUST OFFICIALLY BOOKED OUR AIRBNB FOR NASHVILLE!!!!!!!,0.0,0.0,1.0,0.0
"I have used @Airbnb in the past, but I can’t say I’ll utilize their services again. Due to #SXSWCancelled, myself and @RifewithKatie had no recourse but to cancel our trip and the host Stuart has declined a full refund. This is disappointing and I recommend avoiding his listing.",-0.8573,0.059,0.71,0.231
Nah Airbnb sex takes the cake and eats it too ,-0.1027,0.0,0.865,0.135
The fun of using Airbnb. #cochella mess. #coronavirus nightmare. #music,0.2023,0.239,0.58,0.181
"Armed with video of nightmare Airbnb party house, Lincoln Park alderman aims to bolster city regulations. ",0.4019,0.153,0.847,0.0
Coachella ticket and airbnb refund is about to be tax return 2.0,0.0,0.0,1.0,0.0
Do you have to pay a special premium to get the ‘Break up’ Airbnb? #TheBachelor,0.3182,0.168,0.745,0.087
"Dear @coachella, please advocate and work with @Airbnb to give us back our full refunds if they cannot guarantee adjustment accomodations of our current reservations. They are currently denying California as not meeting their criteria for the exenuating circumstances of COVID-19.",0.1926,0.106,0.804,0.09
"Id be hot if I booked airbnb, flight all dat lol ",0.4215,0.237,0.763,0.0
Church of 8 wheels to get evicted and turned into a 36 room AirBnB hotel. Anyone stopping this @DeanPreston ?,-0.1531,0.0,0.909,0.091
There’s a google form,0.0,0.0,1.0,0.0
@Airbnb @AirbnbHelp so yall are refusing full refunds to booked coachella housing even though Riverside county declared a public health emergency and there are already CONFIRMED cases of COVID-19 in coachella valley??? u put an extenuating policy that literally helps nobody besid,-0.5429,0.057,0.81,0.134
".@Airbnb has agreed to refund two customers quarantined on the Grand Princess in Oakland after initially denying the travelers their money back, saying they needed more documentation. ",0.4019,0.162,0.762,0.076
"As COVID-19 spreads, online travel sites face challenges as bookings slump; Airbnb launches ""More Flexible Reservations"" to refund guests more easily (@eringriffith / New York Times) https://www.nytimes.com/2020/03/10/technology/airbnb-hosts-coronavirus.html",0.6353,0.212,0.788,0.0
Airbnb hosts are being asked to do the unthinkable to stem losses from cancellations during the coronavirus crisis — find long-term renters. https://www.nytimes.com/2020/03/10/technology/airbnb-hosts-coronavirus.html?referringSource=articleShare,-0.7783,0.0,0.746,0.254
"It’s all comes out in our favor, especially if they follow through with postponement. I’d rather lose Airbnb money than spend thousands on my mother’s hospital bills or her funeral if she catches the virus from all the people coming from all over the world creating a petri dish.",-0.0772,0.091,0.813,0.096
Got bodied this weekend - Parking ticket at Airbnb - Coronavirus killed plans - Lost ~$10K in income from missing work - Someone put a hole in the wall at the Airbnb Still happy with the event we did get - it was phenomenal! Was really nice to spend time with everyone too! ,-0.4197,0.116,0.719,0.164
Airbnb creates $1M competition to build fantasy homes https://trib.al/mAkOGV0,0.2732,0.208,0.792,0.0
"Learn how #tech is taking leadership on addressing #COVID19 here in San Francisco and elsewhere. Read about the #coronavirus responses of companies @Airbnb, @AlaskaAir, @Dropbox, @Facebook, @Google, @Microsoft, @Pinterest, @Postmates, &amp; @Twitter",0.0,0.0,1.0,0.0
Airbnb tweaks its refund policy to adjust for coronavirus cancellations ,0.0,0.0,1.0,0.0
There is an SNP Council in our capital. Why is it letting City parks to London scam artists. Why is it closing local bus services. Why is it expelling locals by allowing excessive Airbnb? Why is it subsidising company central to Amazon forest burning? Just asking. ,-0.7149,0.033,0.837,0.13
aussie harries travelling together n staying in an airbnb together ,0.0,0.0,1.0,0.0
Airbnb’s really use to be it a few years ago for any size group or duration. Now they’re mostly ideal for large groups or extended stays bc of the greed.,0.1779,0.103,0.816,0.082
Yes bc Airbnb’s wanna charge a $100 cleaning fee AND service fee..... ,0.4019,0.213,0.787,0.0
"A historic ocean liner may get a second life as a hotel, or an Airbnb, as a real estate developer embarks on a $500 million renovation of the ""most famous ship that didn’t sink"" ",0.0,0.0,1.0,0.0
These Airbnb niggas keep texting me about stuff that’s broken. I just deleted the app.,-0.6705,0.0,0.686,0.314
"In Tokyo, one Airbnb host lost around $2,000 worth of bookings in January, $10,000 in February, $25,000 so far in March and $40,000 in April. @eringriffith on the toll",-0.1027,0.061,0.865,0.074
just copped the Airbnb for Deja who tryna come? ,0.0,0.0,1.0,0.0
"With travel shutting down, what happens to Airbnb, http://Booking.com VRBO and the mini-economy of hosts, cleaners and management companies that depend on them? https://www.nytimes.com/2020/03/10/technology/airbnb-hosts-coronavirus.html",0.0,0.0,1.0,0.0
"Thanks to my @Airbnb host Bolesław for allowing us to cancel our #Gdynia2020 rez without penalty. As #CoronavirusOutbreak worsens, how we treat each other in day-to-day life will determine how deep this crisis actually gets. Be kind and understanding as much as possible.",0.1293,0.2,0.627,0.174
my airbnb is a dream ,0.25,0.4,0.6,0.0
your mcm said he was staying at his house til april 3rd due to the coronavirus scare but just extended his airbnb in san juan to the 4th. focus on yourself,-0.2732,0.0,0.935,0.065
okay but like airbnb full of gays for LA pride? who’s in??? ,0.8299,0.493,0.507,0.0
" THIS SATURDAY 03/14 FREE DAY PARTY @2 FREE AIRBNB KICKBACK @9:30 EVERYBODY FREE, EVERYBODY INVITED #SSU #SSU23 #SouthernNotState",0.948,0.526,0.474,0.0
it’s really wack that people on airbnb don’t uphold their end of the bargain on breakfast,0.2023,0.107,0.893,0.0
 @Airbnb should add an option for people in the #CambridgeMA area (+ others) to post available rooms free of charge for #Harvard students who can’t get home #COVID19,0.5106,0.109,0.891,0.0
Me pretending to be sad about Coachella getting pushed back knowing I need that Airbnb money back ,-0.4019,0.076,0.757,0.168
I don't like to be public with anything but @FTHTravis and @xBAMSTR owe me a total of $280 or $140 each for the airbnb last weekend. They have refused to dm or update me and i have been more than generous. I'll tweet this everyday idc i have bills and stuff to pay plus a kid otw.,0.2293,0.083,0.816,0.101
I've still yet to get a response from @Airbnb @AirbnbHelp despite this being on the front of your page. Still would like my rest of my refund. Seems like a lot of others aren't getting refunds on the support forms either despite you saying you will.,0.7717,0.158,0.842,0.0
"When the niece of guests quarantined on the Grand Princess said #Airbnb refused to refund their upcoming stay without documents they simply could not get, @nbcbayarea's Investigative Unit found it appeared against company policy on outbreaks. #coronavirus",0.2023,0.075,0.871,0.055
We’ve just #SOLDOUT the @TheCedar this Sunday night! Thanks everyone We also have a brand new AirBnB Sessions video in YouTube!!! Check out our version of Caledonia https://youtu.be/K_PfOeEWIcE,0.6209,0.135,0.865,0.0
"Kids who are unable to go home due to whatever reason better be given some money to book a flight, hotel or airbnb bc that is unacceptable.",-0.0258,0.097,0.803,0.1
How many people can you stuff into an Airbnb party house? Watch this video and try to count. Lincoln Park Alderman Michele Smith distributed the footage yesterday as she aims to beef up Chicago’s short-term rental ordinance. ,0.4019,0.07,0.93,0.0
Renting out my 3 bedroom house on AirBnB. £40 a night per person DM if interested ,0.4019,0.172,0.828,0.0
Opportunity for big brands to really do good right now. Some examples: @Airbnb to open up to all the people displaced @BrightHorizons or @CareDotCom to help w/ children when schools are shut down @Headspace or @talkspace to offer free subscriptions to help with anxiety,0.9182,0.27,0.699,0.031
If anyone needs a place to stay for @UbbiDubbiFam I have two spots in my Airbnb with my friends!! Were super friendly hmu for details !!! @TexasEDMFamily,0.9075,0.341,0.659,0.0
"Where to stay: We stayed at a 2 bedroom AirBnb that was 9 k per night. So the four of us paid 2,250 bob per person per night. Here’s a link to the crib https://abnb.me/RNkB4CI2J4",0.0,0.0,1.0,0.0
I love my Airbnb near the Emory campus. Maybe I can just move into their garage permanently? ,0.6369,0.231,0.769,0.0
I feel like this DVD player in my AirBnB is speaking to our times. ,0.3612,0.172,0.828,0.0
