Comment,Compound,Positive,Neutral,Negative
"That’s right baby, I’m an AirBnB Super Host- you might call me a magnate. I also rent to multiple Cheesecake Factories- it’s called diversifying ",0.5994,0.157,0.843,0.0
“But AirBnB doesn’t affect the rental market! Look at this “study” we paid for to show that!”,0.0,0.0,1.0,0.0
There is a statue of a clown playing the violin at the Airbnb I just checked into. I’ll see you all in hell. ,-0.5859,0.074,0.738,0.189
Offering Airbnb slumlords a tenth of what one of their properties is worth so they can pay next month’s mortgage on the rest of them and not lose their entire portfolio.,0.36,0.127,0.823,0.051
"Hey @Airbnb what's the deal with publicly announcing full cash refunds for bookings affected by COVID-19, but only *actually* offering a 10% refund? My wife is high risk. We cannot go on her dream trip to Maui. The host even tried to cancel for us. $200 is not $2,000.",-0.4497,0.047,0.831,0.122
"As an example, here are downtown Toronto airbnb listings in October, 2018. In that rectangle - roughly bounded by Strachan, Church, the lake, and Queen Street - there are 3,788 listings shown. CityPlace, Fort York, Entertainment District, King West, South Core... ",0.4215,0.069,0.931,0.0
"There will undoubtedly be attempts at eviction-by-rent-increase, but most of the airbnb universe is in buildings that were first occupied for residential purposes before Nov 15, 2018. ",0.0,0.0,1.0,0.0
"Global tourist traps are being slammed shut by the coronavirus, and the ecosystem that sprang up around them is falling apart — including Airbnb ",-0.1531,0.0,0.932,0.068
"Did the rough math on it yesterday. 7mm Airbnb worldwide. 600k in US. 2mm people stay/night. Figure 2/Airbnb = 14% occupancy. Avg cost/night = $80. Revenue lost per night is $40mm worldwide, $3.4mm in US if occupancy down only 50%. $1.2B lost revenue each month lockdown.",-0.5574,0.0,0.901,0.099
"So with Covid over 8 weeks we sorted out global warming. Over 3 weeks we froze rents, we got rid of Airbnb &amp; we got homeless into much nicer and non crowded accommodation. I wonder is there any other ovewhelming world / national problems we can sort over the next 4 to 8 weeks?",0.2023,0.086,0.862,0.052
"In Seattle all the AirBnB hosts have dumped their entire inventory on the rental market due to the collapse of tourism. They finally gave up trying to get huge rent. There are places, NICE places on Zillow for $750 1br and prices like that haven' been in Seattle since 2005",0.347,0.141,0.76,0.1
"I AM EXHAUSTED. Spent all day (so far) cleaning up and even redecorating my guest bedroom so I can AirBNB it… to myself for my luxury vacation to Puerto Backyardo this weekend. Gosh, I hope the weather will be good when I get there. I need this vacation!",0.4327,0.124,0.811,0.066
"Okay, so... I’ve never seen this website before and it looked questionable to me, but noted good human @Taylorvaisey looked into it and... the letter from Airbnb is actually real! The company sees their asks as a way to help out Airbnb owners in a crisis. ",0.2244,0.165,0.704,0.131
"Thinking about the bigger picture here, there are a lot of apartments that got financed and built on the back of anticipated Airbnb demand in Canada and elsewhere. Now that demand has dried up and the units are hitting the open market. Sounds like a positive filtering story",0.6249,0.119,0.822,0.059
All them free market capitalists talking about how @AirBnB is simply a function of the market choosing better ROIs on STR over long term tenants are now suddenly socialists seeking a government handout #vanre #B.C. poli,0.7351,0.162,0.838,0.0
AirBnB “super” hosts are really just “irresponsibly levered up” Will blow up by Q3.,0.0,0.0,1.0,0.0
If AirBNB gets this money we riot. ,-0.5574,0.0,0.625,0.375
"fuck you @Airbnb, you don’t get to aggressively ignore government housing regulations and then ask them for a bailout. Go ask Andresseen, Y Combinator, Graham, and all your other government hating billionaire buddies ",-0.9001,0.0,0.667,0.333
NYC worlds collide: I am in a price-deflated airbnb on Carrie Bradshaw's street writing about overrun hospitals.,-0.0772,0.0,0.915,0.085
"Just going to relive Mania weekend last year through my saved videos and images on my phone, here is @wwehornswoggle angry I wouldn’t pay the $60 fee to unlock the Airbnb early.....simper times ",-0.2263,0.077,0.795,0.129
for why tf yall started shading dua for. girlie just chills in her airbnb and makes a good music and gets #1 without begging anyone. be like dua,0.6597,0.178,0.822,0.0
I would pay pretty serious Airbnb money for an extremely sanitized room that is completely empty save for a Half Life Alyx setup,0.5974,0.243,0.582,0.174
"A lot of airbnb units are appearing as furnished rentals for 1-year (or shorter) terms. If you rent such a property, even if for a fixed term, remember that: - if you don’t give notice, your tenancy continues after one year. - you can’t be evicted to resume STR operations. ",0.0,0.0,1.0,0.0
Can’t wait for this to end so I could rent a huge Airbnb with pool with my best friends and have the time of our lives,0.8709,0.32,0.68,0.0
Last year I was evicted for “landlord use” after paying cash rent for 4 years. The landlord created an @Airbnb account a month before I moved out. That’s a bad faith eviction. I’ve filed a dispute. I’d like to see how many @Airbnb hosts claim that revenue in their taxes.,-0.4404,0.134,0.697,0.169
"""@AirbnbHelp"" Rep: Sorry, you don't qualify for a refund under our COVID 19 policy. You can read it here. *goes to @Airbnb policy* ""You totally qualify, but we hoped you wouldn't fact check us."" Good one. I'd like you to meet @MyLawyerFriend.",0.8847,0.216,0.761,0.024
Should governments bail out @Airbnb hosts in Canada? #vanpoli #vanre #bcpoli #canpoli 72 hours poll based on @thinkpolca article: https://thinkpol.ca/2020/04/01/airbnb-asks-government-bail-hosts-canada/,0.0,0.0,1.0,0.0
Honestly if the government bails out AirBnB hosts and offers renters nothing but “I hope you landlord isn’t Scrooge” I’m going to get very loud and annoying,-0.7231,0.061,0.726,0.213
There are a lot of factors impacting Toronto's housing crisis but AirBnB is a HUGE part of the problem. Im sorry but AirBnB hosts should not receive any part of a bailout. We only have a 1/3 of the long term housing we need available.,-0.4767,0.082,0.732,0.186
"“Airbnb’s ask for government bailouts come even as a study last year funded by the Government of Canada found that short term rental platforms have taken out at least 31,000 homes from the long term rental market.” #getstuffed",0.0,0.0,1.0,0.0
Not an April Fool's Joke! You would think Airbnb would just be grateful that governments have turned a blind eye to the fact that their hosts have been running illegal commercial businesses in residential properties for years &amp; have inflated rents in every city they operate in ,-0.3382,0.097,0.781,0.123
"Airbnb is asking the federal gov't for a bailout of their hosts. This is a multinational company worth billions of dollars, which has devastated our long-term rental housing stock. https://thinkpol.ca/2020/04/01/airbnb-asks-government-bail-hosts-canada/ #onpoli #affordablehousing #covid19canada",-0.5423,0.054,0.793,0.153
Until I saw this I wasn't aware AirBnB was seeking a bailout. And Uber too? I say we should pay them in NYC Taxi Medallions,-0.2023,0.0,0.872,0.128
Solo quiero ir a un Airbnb donde pueda estar en tetas en la piscina living my best life with a blunt and a view,0.6369,0.174,0.826,0.0
"Still being committed to pushing #enugu and contents therein. See what an $18 #Airbnb apartment in Enugu looks like. Click here to watch https://youtu.be/yytNYD4xff4 Do not forget to Subscribe, Like &amp; Comment.",0.7761,0.238,0.762,0.0
"Quite surprised to see #Airbnb service companies still operating in lockdown. This one on Dublin Street, #Edinburgh today parked on double yellows. The traffic wardens just walked past the van without stopping. Surely travelling between properties is not essential, and adds risk?",-0.2189,0.079,0.824,0.098
"Zactly. AirBNB was supposed to be for ""I'm going away for 3 weeks and someone else could stay in my house"" or ""We have a guest room and I'd like to have occasional paying guests to help us stay in our otherwise unaffordable home now that the kids are grown up"". Not ghost hotels.",0.7321,0.128,0.872,0.0
The Airbnb bailout is simple: put your unit back on the long term rental market. End of bail out.,-0.1027,0.0,0.928,0.072
Airbnb has had a disastrous impact on cities’ rental markets. Will a post-Covid-19 society really want that back? ,-0.5118,0.082,0.718,0.2
This is so good it deserves a snitch tweet @Airbnb,0.5777,0.319,0.681,0.0
"Great news! The @Airbnb bubble has burst and numerous ""entire homes"" are being returned to the long-term private rented sector. They must NEVER be permitted to revert to tourist accommodation ... ",0.6588,0.128,0.872,0.0
"Thanks Adam, glad to see this is your position! AirBnB hosts contributed to the housing crisis. If they aren’t earning the income they hoped for, I would encourage them to sell their properties, or lease them to long term tenants.",0.7901,0.241,0.677,0.082
"""Newsflash, @Airbnb! You're operating in a highly volatile economic sector"" @shelleycarroll takes a dim view of govt bailout going to Airbnb on @NEWSTALK1010 #topoli #StayHomeSaveLives",-0.1759,0.0,0.929,0.071
"Wow, my housing crisis analysis work got a mention in the New York Magazine. Will the Coronavirus Kill Airbnb? https://nymag.com/intelligencer/2020/03/how-coronavirus-is-affecting-airbnb-and-apartment-rentals.html #housingcrisis #Coronavirusireland #COVID19Pandemic #Dublin #NewYork #coronausa #airbnbcollapse #Airbnb ",-0.7184,0.104,0.656,0.24
"‘In blow to Airbnb, EU court adviser says solving housing shortage is priority’ ",0.1027,0.156,0.714,0.13
"@Airbnb is a tax dodge that destroys communities. Our major cities are in an ongoing housing crisis, there is a worldwide pandemic, and you parasites want a bailout? I hope every #Airbnb host loses their properties.",-0.802,0.101,0.625,0.274
Housing in Australia is flooding back on to the long-term rental market from AirBnB. https://www.domain.com.au/news/more-rentals-hit-the-market-as-tenants-look-to-save-cash-945377/,0.0,0.0,1.0,0.0
ye can count the number of fucks Scotland is giving about the fringe being cancelled on wan classic donut. But I bet theres a shit ton of airbnb fucks needing that panic bought fucking toilet paper noo.,-0.9451,0.059,0.585,0.356
"Ke batla views when lockdown ends. A mooi AirBnB, good food and good company. I’m actually willing to spend this time",0.7003,0.244,0.756,0.0
"Coronavirus has once again made the concept of family very important. The sharing economy -- the likes of Uber, Airbnb -- has gone for a toss. Even individual houses will be preferred over flats/apartment complexes, for those who can afford, ie.",0.788,0.177,0.823,0.0
The Airbnb bubble is bursting. That might not be so bad https://www.bloomberg.com/opinion/articles/2020-04-02/will-airbnb-become-obsolete-after-the-coronavirus?srnd=opinion,-0.6696,0.0,0.71,0.29
"Gonna get a PHAT ASS Airbnb, everyone invited ",-0.6408,0.0,0.586,0.414
"#Airbnb “disrupted” housing for locals and doesn’t pay employment benefits either. No sympathy, no bailouts",0.0772,0.244,0.478,0.278
"Hard NO. Majority are predatory commercial operators and investor speculators. #Airbnb corp has deepened #housingcrisis, while offshoring to #taxhavens. Hosts removed hsg stocks, raised rents, #AirbnbCollapse #vanre #toRE #investorspec #cdnre #cdnpoli",-0.516,0.0,0.87,0.13
"More than 75% of hotel rooms are vacant, thanks to the coronavirus pandemic. @AirBnB has set aside $250 million pay their hosts 25% of the revenue they lost due to coronavirus cancellations. ",0.0516,0.081,0.815,0.104
"After Years of Hoarding Places to Live, Airbnb Hosts Are Panicking https://www.vice.com/en_ca/article/5dma7q/after-years-of-hoarding-housing-supply-toronto-airbnb-hosts-are-panicking?utm_campaign=sharebutton via @vicecanada",-0.4404,0.0,0.818,0.182
The dream companies at different times for a software engineer: 1990 : @IBM 1995 : @Microsoft 2000: @Yahoo 2003: @Google 2008: @Facebook 2010: @Uber 2013: @Airbnb 2015: @Netflix 2017: @databricks This is just a survey done on limited engineers #100DaysOfCode #javascript,0.0258,0.051,0.9,0.049
Once this is all over Im taking a full week vacation and getting an Airbnb right next to the beach.,0.0,0.0,1.0,0.0
Ridiculous. Anyone who uses airbnb for its intended purpose - to host in a spare room or to rent out their house while they are away - will be completely unaffected by COVID. People who bought entire buildings to airbnb the apartments though? they can eat the downside,-0.5423,0.0,0.905,0.095
"Planned a trip to Denver last month & chose not to go due to the government’s advisory against unnecessary travel. @Airbnb says this was not a valid claim &amp; that it doesn’t qualify for their Covid-19 refund policy. I am out $1,200 &amp; will never use @Airbnb again. Shit company",-0.5574,0.0,0.926,0.074
Friend is safely in an Airbnb. Thank you to everyone who helped us figure this out ,0.836,0.406,0.594,0.0
Totally agree. Nothing but the cold dead invisible hand of the market for Airbnb...,-0.191,0.268,0.475,0.257
The predators at AirBNB do not deserve a bailout. AirBNB didn’t even respect the laws in place during the housing crisis. Now they want a bailout? #VanRe #ToRe,-0.0279,0.218,0.654,0.128
April fools we actually didn’t move into that house... It’s an Airbnb. Real house is in Hawaii once this quarantine is over,-0.4939,0.0,0.868,0.132
"robert gibbs, obama’s first press secretary: comms for mcdonalds demetrios marantis, obama’s trade rep (negotiated the TPP!): exec at square eric holder, obama’s AG: exec at airbnb ryan metcalf, obama’s WH senior advisor: works for paypal’s cofounder, max levchin",0.0,0.0,1.0,0.0
"Have you seen Craigslist? 2,800 available rental units in Toronto, 2 bedrooms going for under $2,400 - I've never seen anything like this in the last 10 years at least. T.O. is usually at between 1-3% available inventory of rentals. Has to be all the empty Airbnb condos.",-0.4423,0.0,0.918,0.082
Wow. After years of displacing front line workers/ruining housing markets & neighbourhoods/undermining union jobs/avoiding taxes/skirting laws & bankrolling appeals to gvt regs @AlexDagg asks #Cdnpoli for to bailout #Airbnb. April fools joke? Not quite. ,0.34,0.155,0.725,0.119
"Another day another scoop, thanks to help from awesome @business colleagues. Airbnb has held talks about a convertible note which may help it get through this tough time ",0.9076,0.382,0.573,0.044
"I wonder how the AirBnB ""Superhosts"" with 10+ mortgages are holding up with no rental income to sustain their extreme levels of leverage...",-0.296,0.0,0.905,0.095
"all these city landlords & airbnb hosts are counting on things going back to ""normal"" in a few months #RentStrike",0.0,0.0,1.0,0.0
"What do the following #startups have in common? #Uber, #Airbnb, #Slack, #Pinterest, #WhatsApp, #Square, #Venmo They were founded during the last recession (2008-2009) Don't lose hope – build an amazing company! Be creative! Educate yourself as much as you can online Goodluck!",0.6836,0.193,0.705,0.102
"Does anyone know of any housing available in Miami, FL? A Black trans woman has reached out to us and is looking for more permanent housing. She is technically homeless + has been having to use Airbnb’s but that’s becoming less of an option due to COVID-19. Please share ",0.714,0.136,0.864,0.0
Chicago couple offers AirBNB to domestic violence victims during coronavirus pandemic http://nbcchi.com/KNIQSLq,-0.7506,0.0,0.61,0.39
I should’ve arrived in Tampa for AirBnB Wrestling It’s Not Customs It’s Chase Holliday’s Memorial Show’s ring setup today.,0.0,0.0,1.0,0.0
Airbnb's hosts aren't impressed with the company's $260 million package to make up for coronavirus cancellations . 'People see it for what it is — it's PR.' ,-0.3724,0.0,0.904,0.096
"SWers, esp those who book hotels for incalls, if there were an Airbnb like service exclusively for providers where you could rent on a per hour or per day basis would this be something you’d be interested in? SW owned of course.",0.6369,0.118,0.882,0.0
"If you're an Airbnb host with an empty property you'd consider donating for a few weeks or a frontline worker in need of temporary accommodation, this is a brilliant resource to put you together. ",0.4588,0.11,0.838,0.052
"As in the last housing bubble, all sorts of shenanigans has occurred during the making of U.S. Housing Bubble 2.0. One example: over-leveraged AirBnB “super-hosts,"" who are now going bust. https://www.forbes.com/sites/jessecolombo/2020/03/31/why-us-housing-bubble-20-is-about-to-burst/",0.0,0.0,1.0,0.0
"#Airbnb and #COVID19 in #Toronto - Answer: Yes, all the employment insurance you paid to Airbnb and the Canadian goverment as an employee will be paid to you, in full. ",0.4019,0.088,0.912,0.0
"If we get rid of AirBnB, then where are all the rappers gonna pretend they live in their music videos?",-0.1027,0.0,0.931,0.069
"just like the 2008 housing crises decimated places that overbuilt new family homes, feels like 2020 is going to really hurt places like Nashville that rapidly expanded hotel/Airbnb capacity over the last 5 flush travel years ",0.4228,0.178,0.735,0.088
".@Airbnb doesn't care if STRs are illegal. Even when @AirbnbCitizen writes a law making STRs legal under specific conditions, it'll continue rentals that violate those conditions. You can trust that Airbnb is #NotToBeTrusted #HotAirbnb",-0.6836,0.114,0.663,0.223
Let’s have a moment of silence for All the nightlife people who thought they were getting a better life by Becoming Airbnb real estate scammers I know who you are !!!!!!! I will be buying ur Jordan’s on StockX,0.6209,0.107,0.893,0.0
"AirBnB is about to crash the US housing market. Thousands of super-hosts who bought 10, 20, 30 properties with mortgages and are heavily levered...are all about to default. Without travel there is no rental income to pay these mortgages. In 2-3 months - 2008 all over again Boom",-0.6486,0.0,0.875,0.125
Just trying to understand. STRs are banned across #Quebec but #Airbnb still allows STRs to be rented on its platform? Does it ever take responsibility? No cooperation with governments even during #COVIDー19? Amazing work by ⁦@RadioCanadaInfo⁩,0.4479,0.132,0.758,0.11
"In cancelling the Airbnb for the trade show, I will be getting a refund that equals the cost of one Switch Lite (in stock at Best Buy . ca) + Zelda Breath of the Wild. Guess what I did? Video games as lockdown mental health aids? Hell yes.",0.2168,0.138,0.741,0.122
Something that me I am crying about is what you are laughing about . The whole Airbnb ecosystem crumbled in a week! Today is tribulation day for many guys . Mortgage and long lease payment is up ! Thank God I am not too over exposed. I would have just returned to Lagos to NURTW ,0.6711,0.172,0.772,0.056
"US technology companies founded by 1st, 2nd generation immigrants: @Apple (April 1, 1976) Google Amazon Facebook Oracle IBM Uber Airbnb Yahoo Intel EMC eBay SpaceX VMWare AT&amp;T Tesla NVIDIA Qualcomm Paypal ADP Reddit Slack WeWork Stripe Cognizant Intuit 3M Zoom 43% of Fortune 500 ",0.1779,0.038,0.962,0.0
Does anyone know a safe decent affordable furnished studio apartment available for rent in Islamabad?! Like one of those nice places on AirBnB. Need one for around 10 days to 2 weeks.,0.8172,0.239,0.761,0.0
"One thing @jean__hardy mentioned that's stuck with me: the NYT hand sanitizer hoarding guy story is, at heart, a story of someone from the city (Chattanooga) going around to rural areas and wiping out their supply. Not that different, really, from someone fleeing to an Airbnb ",0.296,0.066,0.892,0.041
And she sent a smoothie delivery to our airbnb at that time. UWU brings back all the memories ,0.0,0.0,1.0,0.0
"Last year, someone was putting pressure on me to make a downpayment for some apartments and was guaranteeing me $1500 to $2000 monthly AirBnB revenue per apartment because of Ghana’s ”Year of Return.” I declined. Now, see this life?? Zero revenue from those apartments now. ",-0.3736,0.0,0.943,0.057
"I hope the pandemic lasts maybe 2-3 more months, which is just enough for most Airbnb hosts to default on their mortgaged and trigger the crash of the real estate industry",0.0516,0.086,0.833,0.08
My rent keeps getting cheaper without me doing anything Another advantage of living life as a digital nomad By the time i agreed my rent for this month (Airbnb) it was Around £480 By the time I pay it (tomorrow) it will be £410 ,0.4019,0.094,0.874,0.032
"From :Tony Gardner Airbnb info on there, but if someone wants it then just need proof they work there at Royal Free hospital and they can email me on gardner111@outlook.com",0.6652,0.133,0.867,0.0
"""And at risk of finding a silver lining to this godawful and tragic pandemic, I’ll say it: it would be a good thing if it forces more landlords to rent their units instead of listing them on Airbnb"" Don't settle for anything less than 1 year lease Peeps. ",-0.296,0.058,0.84,0.102
"after ~6.5 years, I’ve left a role as a institutional venture investor at a hedge fund to build a seed venture firm of my own w. a longtime co-investor + friend from Airbnb / Box (@MatthewZiskie) more details about the fund to follow but I’ll be here in NYC + Matt in LA",0.2732,0.046,0.954,0.0
"COVID-19 could mark the end of Toronto’s Airbnb era, and good riddance. Here’s how to keep it that way ",0.4404,0.139,0.861,0.0
"With the news of the #EdFringe cancellation, can we spare a thought for all the Slum Landlords and AirBnB cunts who stand to loose millions. Stay strong guys, you can always boost the prices up in 2021.",-0.0516,0.136,0.724,0.14
"not gutted for the profiteering airbnb landlords tho soz, i can see soo manyyy empty flats around here atm and it's now absolutely time you that hand them over to the people",0.2023,0.092,0.809,0.098
Just cancelled all my hotel and airbnb reservations for the summer. No I’m not okay ,-0.5948,0.0,0.672,0.328
Airbnb refunding us for the holiday we can't take and Santander granting us a mortgage holiday is a flipping great start to a day of recording more songs for my album. Phew!,0.9078,0.331,0.669,0.0
You only hearing that now on WeChat??? You are in the wrong groups… Need to get into the AirBnB managers groups for mainland CN owners - now there are some seriously pissed off people with 10% occupancy since Nov on those groups who now realise they can’t get money out to cover!,-0.8699,0.0,0.83,0.17
scumbag airbnb landlords of edinburgh do you need picking up in the morning pal,-0.6369,0.0,0.756,0.244
hopefully all the fringe and airbnb shit being cancelled puts at least a temporary stop to Edinburgh being systematically gutted for tourism money,-0.6249,0.095,0.632,0.274
Let me find my tiniest violin for those airBnB owners in Edinburgh ,0.0,0.0,1.0,0.0
"We are making an urgent call to hoteliers, B&Bs, Airbnb and serviced apartment owners and private and social landlords to come forward to offer accommodation to house the borough’s homeless during the coronavirus crisis. More info at http://ow.ly/DLux50z1PcQ",-0.5106,0.043,0.859,0.098
"AirBnB is about to crash the US housing market. Thousands of super-hosts who bought 10, 20, 30 properties with mortgages and are heavily levered...are all about to default. Without travel there is no rental income to pay these mortgages.",-0.6486,0.0,0.851,0.149
"In light of the Airbnb fiasco (and possible reignition of the housing mortgage crisis) I'd love if we started thinking about how fucked it is that ANY ""rent your unused X"" app inevitably becomes an abetter of unregulated shadow magnates ",-0.5423,0.086,0.757,0.157
(Airbnb was founded about a year before. But they were dead at the point when they applied to YC in late 2008. They made the decision to resuscitate themselves and take another shot when everyone else was running for cover.),-0.7876,0.0,0.865,0.135
"That's why Y Combinator is funding startups this summer as usual, even if the batch has to be partly or wholly remote. YC knows this from experience. Airbnb was in the winter 2009 batch.",0.0,0.0,1.0,0.0
Yho I’m getting an Airbnb when this shit is done. Ndizithi lockdown with someone’s son for a few days. ,-0.6428,0.0,0.8,0.2
If you watched boiler room You would have foreseen the Airbnb crash That’s the true lesson here kids,0.0258,0.13,0.744,0.126
Call for Airbnb shutdown over 'isolation holiday' promotions ,0.0,0.237,0.526,0.237
It’s time to discuss the mortgages held by AirBnB rental companies. Most companies have several (10-50) properties. No renters = no cash flow = no mortgage payments = mass defaults.,-0.6808,0.0,0.784,0.216
"To be clear: Theres currently massive subsidies and programs that people are abusing, in order to buy WAY over their limits. Scottsdale, AZ, in some areas, has some neighborhoods in which every other house is being flip-renovated to AirBNB. It’s serious. It will impact you. ",-0.1779,0.053,0.859,0.088
"Call their bluff, tell them to get fked and just stop paying. Honestly, the market is becoming saturated with airbnb rentals and other properties where tenants have abandoned ship (home to parents, back overseas). Oh, and insurers likely not covering rental defaults.",-0.296,0.064,0.826,0.11
Airbnb has announced a $250 million Host Relief Fund to cover some costs of coronavirus cancellations ,0.4767,0.181,0.819,0.0
